https://vit.ac.in/sites/default/files/M.Sc.Data-Science-AY-2019-2020.pdf,Multivariate Data Analysis,"3. Learn to develop an in-depth understanding of the Multivariate models, methods and techniques. 4. Demonstrate the knowledge and skill of multivariate normal distributions, related probability distributions and their applications. 3. Examine the relationships between dependent and independent variables of multivariate models, estimate the parameters and fit a model. 4. Perform, handle and manipulate the analysis of discriminant function and logistic regression. 5. Apply the method and analysis of principal components, factor analysis and dimension reduction of sample data. 6. Investigate the events of clustering and multidimensional scaling presence in sample data. 7. Conduct the application of Structural Equation Modeling (SEM) to real-time observations. 8. Research on real-time problems from various disciplines using multivariate data analysis.","Multivariate data and their diagrammatic representation. Exploratory multivariate data analysis, sample mean vector, sample dispersion matrix, sample correlation matrix, graphical representation, means, variances, co-variances, correlations of linear transforms, six step approach to multivariate model building. Introduction to multivariate linear regression, logistic regression, principal component analysis, factor analysis, cluster analysis, canonical analysis and canonical variables, structured equation modeling (SEM)., Introduction to multivariate normal distribution, probability density function and moment 
generating function of multivariate normal distribution, singular and nonsingular normal distributions, distribution of linear and quadratic form of normal variables, marginal and 
conditional distributions. Random sampling from multivariate normal distributions. Goodness of 
fit of multivariate normal distribution. Wishart matrix-its distribution and properties., Maximum likelihood estimation of parameters, tests of linear hypothesis, distribution of partial 
and multiple correlation coefficients and regression coefficients. Multivariate linear regression, 
multivariate analysis of variance of one and two way classification data (only LR test). 
Multivariate analysis of covariance. , applications in testing and 
confidence set construction, Discriminant model and analysis: a two group discriminant analysis, a three group discriminant 
analysis, the decision process of discriminant analysis( objective, research design, assumptions, 
estimation of the model, assessing overall fit of a model, interpretation of the results, validation of 
the results). Logistic Regression model and analysis: regression with a binary dependent variable, 
representation of the binary dependent variable, estimating the logistic regression model, assessing 
the goodness of fit of the estimation model, testing for significance of the coefficients, interpreting 
the coefficients., Population and sample principal components, their uses and applications, large sample 
inferences, graphical representation of principal components, Biplots, the orthogonal factor 
model, dimension reduction, estimation of factor loading and factor scores, interpretation of 
factor analysis., Concepts of cluster analysis and multidimensional scaling, similarity measures, hierarchical 
clustering methods, Ward’s hierarchical clustering method’s, nonhierarchical clustering 
methods, K-means methods. Clustering based on statistical models, multidimensional scaling 
and correspondence analysis, perceptual mapping., Concept of structural equation modeling, Confirmatory factor analysis, canonical correlation 
analysis, conjoint analysis., Research and Analytical problems of multivariate data / statistical analysis from science, engineering, 
industry, economics, environment, commerce, medicine & health, general and administrative 
management etc."
https://vit.ac.in/sites/default/files/M.Sc.-Business-Statistics.pdf,Foundations of Business Mathematics,"1. Students shall know how to solve the various business problems using Business Mathematics concepts. 2. Students shall be able to use and apply a wide variety of Business Mathematics concepts for various manufacturing and service industries. 3. Students will be able to understand the mathematical concepts and terminology involved in derivatives, basic arithmetic operations on vectors and matrices, including inversion and determinants. 4. Apply Business Mathematics techniques in Business Problem.",
https://vit.ac.in/sites/default/files/M.Sc.-Business-Statistics.pdf,English for Science and Technology,"1. Make effective presentations and display their interpersonal skills in academic and professional contexts. 2. Emerge as good listeners and critically evaluate oral communication. 3. Excel in reading, comprehending and interpreting technical reports, texts and data. 4. Able to write effectively in English and also display their proof-reading abilities. 5. Face real interviews and handle personal and professional conflicts effectively.",
https://vit.ac.in/sites/default/files/M.Sc.-Business-Statistics.pdf,Essentials for Business Etiquettes - Soft Skills,,
https://vit.ac.in/sites/default/files/M.Sc.-Business-Statistics.pdf,Preparing for Industry,,
https://vit.ac.in/sites/default/files/M.Sc.-Business-Statistics.pdf,Research Methodology,,
https://vit.ac.in/sites/default/files/M.Sc.-Business-Statistics.pdf,Data Analysis and Decision Modeling,"1. Learn to develop in-depth understanding of the data analysis and decision modeling. 2. Demonstrate the knowledge and skill of data scaling, acquisition, handling, and manipulation.. 3. Examine the relationships between dependent and independent variables of simple and multiple regression models estimate the parameters and fit a model. 4. Perform, handle and manipulate the analysis of various types of data and develop an appropriate decision model. 5. Apply the methods of random number generators and use it to solve real life problems. 6. Investigate various types of model using spreadsheet, simulation and decision modeling. 7. Conduct application of regression modeling to real time observations. 8. Research on real time problems from various disciplines using data analysis and decision modeling.","Data and its measurement, absolute and relative measures of data, data scale (nominal, ordinal, interval, and ratio), data types, methods of data acquisition, normalization of data, 
visualization of data, Time series plots, Box plot, stem and leaf diagram, exploring data with 
pivot table, data cleansing, concept of outliers, concept of Z- score, identification of an 
outliers using Z score and box plot., Processing of data, methods of getting right data, sources of data, data sources on webs, 
official statistics, data handling using excel auto-filter, complex queries with advanced filter, 
importing external data from Access, creating pivot table from external data, data cleansing, 
handling the missing data, data manipulation, summary statistics and process of decision 
making, Introduction, elements of decision making,, the precision tree, decision problems: single and 
multistage, Bayes rule, numerical problems cases, and applications based on binomial, 
poisson, normal and exponential distributions., Concept and meaning of random number and its relevance, methods of random number 
generator. Techniques for Generating Continuous Random Variates, Generating Discrete 
Random Variates, simulating a non – homogeneous Poisson Process and queuing system., Concept and definition of a model, steps of modeling, simple and multiple regression model, 
estimation of coefficients, fitting of a model, drawing inferences for regression coefficients, 
concept of 𝑅
2
and adjusted 𝑅
2
. Problem of overfitting of regression model, model 
validation, construction of confidence interval for regression coefficients, developing 
prediction interval. Concept of autocorrelation, multi-collinearity. Test of linearity, test of 
normality, and the test of heteroscedasticity for a given regression model. Error analysis and 
measurement of the forecast accuracy. , Work force scheduling models, aggregate planning models, logistic models, dynamic 
financial models, integer programming models , Introduction to Simulation modeling, Discrete Simulation model, Continuous Simulation
model, Monte-Carlo simulation. Spreadsheet simulation modelling, selecting probability 
distributions for specific simulation, simulating correlated values., Related to Research and Analytical problems of multivariate data, data analysis and decision 
modeling from business, economics, commerce, science, engineering, industry, environment, 
medicine & health, general and administrative management etc"
https://vit.ac.in/sites/default/files/M.Sc.-Business-Statistics.pdf,Business Statistics with R,"1. Compute and interpret descriptive statistics using numerical and graphical techniques. 2. Understand the basic concepts of random variables and find an appropriate distribution for analysing data specific to an experiment. 3. Display conceptual understanding of the nature of data analysis and probability modelling. 4. Apply statistical methods like correlation, regression analysis in analysing, interpreting experimental data. 5. Make appropriate decisions using statistical inference that is the central to experimental research. 6. Demonstrate R programming for statistical data.","Introduction to Statistics - Data Collection and Presentation - Categories of Data Groupings -Exploring Data Analysis - Descriptive Statistics: Measure of Central Tendency, Measure of Dispersion, Installation of R Software - Basics of R: Scalars, Vectors, Matrices, Data Frames, Lists, Data 
Creation, Data Type Conversion, Variable Information – Basic Operations in R – Control Structures – Statistical Probability Functions in R – Importing Data – Packages – Working 
Directory and R Script – Data Exploration and Visualization., Experiment - Sample Space – Event - Axioms of Probability - Basic Properties of Probability 
- Conditional Probability - Computation of Probability in R - Simulation of a Random 
Sample in R - Random Variables: Discrete and Continuous Random Variables, Marginal, 
Conditional Distributions – Mathematical Expectation and its Properties – Covariance –
Moment Generating Function – Characteristic Function., Binomial Distribution – Poisson Distribution – Normal Distribution and Standardized 
Normal Distribution– Exponential Distribution – Student’s t-Distribution – Chi-square 
Distribution – F-Distribution – Use of the Probability Distribution in Business Problem 
Solving Using R., Probability and Non Probability Sampling - Probability Sampling Technique: Simple 
Random, Systematic, Cluster and Stratified - Non Probability Sampling Technique: 
Judgment, Quota and Convenience – Advantages and Disadvantages - Sampling Distribution 
of the Mean - Central Limit Theorem and Its Significance., Testing of Hypothesis – Types of Errors – Critical Region – Large Sample Tests: Z-Test for 
Single Proportion, Difference of Proportions, Single Mean and Difference of Means - Small 
Sample Tests: Student’s t-Test and F-Test - Chi-Square Test: Goodness of Fit and 
Independence of Attributes – Design of Experiments – Analysis of Variance: One and Two 
Way Classifications – Point Estimates and Interval Estimates - Method of Moments and 
Maximum Likelihood – Confidence Interval., Correlation and Regression – Rank Correlation – Partial and Multiple Correlation –
Multiple Regression."
https://vit.ac.in/sites/default/files/M.Sc.-Business-Statistics.pdf,Modelling and Simulation,"1. Have a comprehensive understanding of the theoretical foundations of stochastic simulation, including random number generation, sampling from discrete and continuous distributions, and statistical analysis of transient/steady-state outputs. 2. Build realistic discrete-event simulation models using industry-standard software. 3. Apply simulation model building and analysis skills to systematically frame and solve complex business planning problems. 4. Explain Verification and Validation of simulation model. 5. Interpret the model and apply the results to resolve critical issues in a real world environment. 6. Demonstrate various statistical softwares for simulation technique.","Introduction to Simulation modeling, Advantages, Disadvantages, Areas of application, System environment, components of a system, Model of a system, types of models, steps in a simulation study. Simulation Examples: Simulation of Queuing systems, Simulation of Inventory System, Other simulation examples., Concepts in discrete - event simulation, event scheduling/ Time advance algorithm, simulation using event scheduling, Random Numbers: Properties, Generations methods, Tests for Random number- Frequency test, 
Runs test, Autocorrelation test. Random Variate Generation: Inverse Transform Technique_x0002_Exponential, Uniform, Weibull, Triangular distributions, Direct transformation for Normal and log 
normal Distributions, convolution methods- Erlang distribution, Acceptance Rejection Technique, Robust Heuristics, Random Search, Input Modelling: Data collection, Identification and distribution with data, parameter estimation, 
Goodness of fit tests, Selection of input models without data, Multivariate and time series analysis. 
Verification and Validation of Model – Model Building, Verification, Calibration and Validation of 
Models, Types of Simulations with Respect to Output Analysis, Stochastic Nature of output data, Measures of 
Performance and their estimation, Output analysis of terminating simulation, Output analysis of 
steady state simulations , Selection of Simulation Software, Simulation packages, Trend in Simulation Software."
https://vit.ac.in/sites/default/files/M.Sc.-Business-Statistics.pdf,Machine Learning with Business Applications,1. Describe what Data Science is and the skill sets needed to be a data scientist. 2. Explain in basic terms what Statistical Inference means. Identify probability distributions commonly used as foundations for statistical modelling. Fit a model to data. 3. Understand the most popular machine learning algorithms 4. Analyze and perform an evaluation of learning algorithms and model selection. 5. Compare the strengths and weaknesses of many popular machine learning approaches 6. Appreciate the underlying mathematical relationships within and across machine learning algorithms and the paradigms of supervised and unsupervised learning. 7. Design and implement various machine learning algorithms in a range of real-world applications,"Big Data Analytics, Business intelligence vs Big data, big data frameworks, Current landscape of analytics., Exploratory Data Analysis (EDA), statistical measures, Data Analytics Lifecycle and 
Discovery, data visualization techniques, Population and Sample, Statistical modelling, probability distributions, fitting a model., The origins of machine learning-How machines learn - Machine learning in practice_x0002_Exploring and understanding state-of-the-art methods, Learning Associations-Classification-Regression- Decision Trees - Reinforcement Learning_x0002_Probably Approximately Correct Learning (PAC)-Noise-Learning-Multiple classes-Model 
Selection and Generalization- Support Vector Machines., Introduction- Subset Selection-Principal Component Analysis, Feature Embedding-Factor 
Analysis-Singular Value Decomposition, Linear Discrimination: Introduction- Generalizing the Linear Model-Geometry of the Linear
Discriminant- Linear Discriminant Analysis- Pairwise Separation-Gradient Descent_x0002_Logistic Discrimination. Clustering: Introduction, K-Means Clustering- Mixtures of Latent 
Variable Models- Spectral Clustering-Hierarchical Clustering-Clustering, Choosing the 
number of Clusters., Practical knowledge on machine learning techinuques in data science."
https://vit.ac.in/sites/default/files/M.Sc.-Business-Statistics.pdf,Decision Support Systems,"1. Explain the nature of modelling and how real-world systems may be represented in mathematical form and realised on a computer. 2. Determine when a realistic problem is in non-standard form and represent it quantitatively using a computer. 3. To examine examples and case studies documenting computer support for organizational decision making, and various planning, analysis and control tasks. 4. Distinguish among data processing systems, management information systems, and decision support/expert systems. 5. Analyze how information is used to solve problems.","The Characteristics and elements of systems, General systems model, Explore communication systems, Differentiate between data processing systems, management information systems, and decision support systems., Elements of problem solving process - Problems versus systems - Structured, unstructured, 
and semi-structured problems - The systems approach and its relationship to the scientific 
approach., Development of DSS - Relationship to data processing and database systems - DSS 
development and implementation - DSS features and capabilities - DSS in the information 
center, Expert behaviour in decision-making situations - Knowledge capture - Expert systems 
development process - Build a minimal expert system - Apply and modify the system -
Multiple levels of knowledge representation - Multiple levels of control and search 
procedures, Modelling with a spread sheet - Hands-on use of a spreadsheet for business decision-making 
- Spreadsheet in the information center., Effects of data manipulation to support decisions in pricing, production, cash flow, and new 
product evaluation models - Proficiency in utilizing expert system, spreadsheet, database, 
graphic and statistical software for ""what if"" analyses., Picking a model type - Validation of models - Management models and expert systems in the 
information center."
https://vit.ac.in/sites/default/files/M.Sc.-Business-Statistics.pdf,Business Computer applications,"1. Gain familiarity with the concepts and terminology used in the development, implementation and operation of business application systems. 2. Explore various methods that Information Technology can be used to support existing businesses and strategies. 3. Achieve hands-on experience with productivity/application software to enhance business activities. 4. Accomplish projects utilizing business theories, Internet resources and computer technology. 5.Work with simple design and development tasks for the main types of business information systems","Fundamentals of information technology concepts – hardware, software, security, and privacy., File management techniques to manipulate electronic files and folders in local, network, and 
online environments, Business documents with word processing software using spelling and grammar check, format and 
layout, tables, citations, graphics, and mail merge., Business documents and analyze data with spreadsheet software using (i) tables, sorting, filtering, 
charts and graphics, pivot tables, macros; (ii) statistical, financial, logical and look-up
functions and formulas; and (iii) add-ins., Business multimedia presentations with presentation software using templates, lists, groups, 
themes, colors, clip art, pictures, tables, transitions, animation, video, charts, and views., Databases and manage data with database software using tables, fields, relationships, indexes, 
keys, views, queries, forms, reports, and import/export functions, Web-based technologies to conduct ethical business research.-goal seeking and what-if analysis to 
solve problems and make adjustments/recommendations in a business environment, Financial Literacy for Banking Scheme and applications"
https://vit.ac.in/sites/default/files/M.Sc.-Business-Statistics.pdf,Applied Multivariate Analysis,"1. Explain the fundamental principles of multivariate normal distribution and sampling theory 2. Apply hypotheses tests to analyze multivariate data 3. Evaluate the different multivariate methods 4. Interpret findings in a scientific and concise manner 5. Demonstrate various statistical softwares such as SPSS, MINITAB and R programming for statistical data.","Introduction to multivariate analysis - Basic statistics of a data set - Data displays and graphical representations – Matrices: Rank, inverse, trace and their properties – Characteristic roots and vectors – Idempotent and partitioned matrices – G-inverse and properties – Reduction of a matrix into diagonal, canonical and triangular forms, Consistency – different types of solutions - Quadratic forms – reductions of different types – Definite 
quadratic forms – Cochran’s theorem., Normal distribution – Bivariate Normal distribution – Multivariate Normal distribution -
Marginal and conditional distributions – characteristic function. Maximum likelihood estimation 
of the parameters of Multivariate Normal and their sampling distributions – Inference 
concerning the mean vector when covariance matrix is known, Total, Partial, Multiple correlation in the Multivariate setup – MLEs of Total, Partial and 
Multiple correlation coefficients. Sampling distributions of Total and Multiple Correlation in 
statistics, A two group discriminant analysis, a three group discriminant analysis, the decision process 
of discriminant analysis( objective, research design, assumptions, estimation of the model, 
assessing overall fit of a model, interpretation of the results, validation of the results)., Classification problems - Scope and its applications - Categorical Data Analysis: Categorical 
response data, logistic regression-odds ratio, Wald’s statistic - Classification into one of two 
populations (known and unknown dispersion matrix) - Classification in to one of several 
populations Linear discriminant function - Multivariate analysis of variance (MANOVA): 
One- Way classification, Principal components – Definition and Properties - Extraction of Principal components and 
their variances - Canonical correlation – Estimation of canonical correlation and variates. 
Factor analysis – Mathematical model- Estimation of Factor Loadings –– Concept of factor 
rotation – Varimax criterion."
https://vit.ac.in/sites/default/files/M.Sc.-Business-Statistics.pdf,Applied Time Series and Business Forecasting,"1. Explain the fundamental principles of different time series models. 2. Identify suitable time series models for a given real-life problem. 3. Apply time series analysis skills and techniques to analyze real-life problems through statistical software. 4. Demonstrate advanced knowledge of the types of data analysis problems that can be appropriately dealt with using forecasting techniques. 5. Successfully develop forecasting models and apply them to real life problems. 6. Demonstrate various statistical softwares such as SPSS, MINITAB and R programming for statistical data","Definition and examples of time series models, graphical representation of time series data, Components and various decompositions of time series models, numerical description of time series, data transformations, methods of estimation, trend and seasonal adjustments., Moving average (MA), weighted moving average, single and double exponential smoothing, Holt’s 
and winter’s methods, exponential smoothing techniques for series with trend and seasonality, basic 
evaluation of exponential smoothing., Weak and strong stationary, auto covariance, autocorrelation function (ACF), partial autocorrelation 
function (PACF), conditions for stationarity and invertibility, autoregressive (AR), , autoregressive 
and moving average (ARMA) models and their statistical Properties, autoregressive integrated 
moving average (ARIMA) processes, choice between stationary and non-stationary models., Spectral analysis of weakly stationary process, periodogram and correlogram analysis, spectral 
decomposition of weakly AR process and representation as a one-sided MA process, implication 
in prediction problems., Forecasting methods: qualitative and quantitative methods, steps involved in stochastic model 
building, forecasting model evaluation, model selection techniques: AIC, BIC and AICC, forecasting 
model monitoring, Nonlinear modeling of financial time series: meaning of non-linearity, non-constant conditional 
variance models for volatility, definition and representation of ARCH and GARCH Models and their 
use in financial time series data, diagnostic checking of model, analysis of residuals., Introduction to business forecasting, forecasting cycle, different forecasting techniques, exploring 
data patterns and choosing forecasting technique, managing forecasting process, measuring 
forecasting error, forecasting error comparison."
https://vit.ac.in/sites/default/files/scope/M.Tech(CSE)_AI_ML_2020_2021.pdf,Mathematics for Artificial Intelligence,,
https://vit.ac.in/sites/default/files/scope/M.Tech(CSE)_AI_ML_2020_2021.pdf,English for Science and Technology,,
https://vit.ac.in/sites/default/files/scope/M.Tech(CSE)_AI_ML_2020_2021.pdf,Soft skills,,
