url,compulsory course,course outcome or overview,topics covered
http://cds.iisc.ac.in/admissions/course-degrees/,Introduction to Scalable Systems,"This course covers computer systems topics that are essential for students engaging in computational and data sciences. It introduces topics on architecture, OS and data structures that may be new to students without a degree in Computer Science. Then it moves to more advanced topics on tree/graph data structures, HPC/GPGPU programming and Big Data platforms.","Architecture: computer organization, single-core optimizations including exploiting cache hierarchy and vectorization, parallel architectures including multi-core, shared memory, distributed memory and GPU architectures; Algorithms and Data Structures: algorithmic analysis, overview of trees and graphs, algorithmic strategies, concurrent data structures; Parallelization Principles: motivation, challenges, metrics, parallelization steps, data distribution, PRAM model; Parallel Programming Models and Languages: OpenMP, MPI, CUDA; Distributed Computing: Commodity cluster and cloud computing; Distributed Programming: MapReduce/Hadoop model."
http://cds.iisc.ac.in/admissions/course-degrees/,Numerical Linear Algebra,,"Matrix and vector norms, floating points arithmetic, forward and backward stability of algorithms, conditioning of a problem, perturbation analysis, algorithmic efficiency, Structured matrices, Solving linear systems, Gaussian elimination, LU factorization, Pivoting, Cholesky decomposition, Iterative refinement, QR factorization, Gram-Schmidt orthogonalization, Projections, Householder reflectors, Givens rotation, Singular Value Decomposition, Rank and matrix approximations, image compression using SVD, Least squares and least norm solution of linear systems, pseudoinverse, normal equations, Eigenvalue problems, Gershgorin theorem, Similarity transform, Eigenvalue & eigenvector computations and sensitivity, Power method, Schur decomposition, Jordan canonical form, QR iteration with & without shifts, Hessenberg transformation, Rayleigh quotient, Symmetric eigenvalue problem, Jacobi method, Divide and Conquer, Computing the Singular Value Decomposition, Golub-Kahan-Reinsch algorithm, Chan SVD algorithm, Generalized SVD, Generalized and Quadratic eigenvalue problems, generalized Schur decomposition (QZ decomposition), Iterative methods for large linear systems: Jacobi, Gauss-Seidel and SOR, convergence of iterative algorithms, Krylov subspace methods: Lanczos, Arnoldi, MINRES, GMRES, Conjugate Gradient and QMR, Pre-conditioners, Approximating eigenvalues and eigenvectors."
http://cds.iisc.ac.in/admissions/course-degrees/,Numerical Methods,,"Root finding: Functions and polynomials, zeros of a function, roots of a nonlinear equation, bracketing, bisection, secant, and Newton-Raphson methods. Interpolation, splines, polynomial fits, Chebyshev approximation. Numerical Integration and Differentiation: Evaluation of integrals, elementary analytical methods, trapezoidal and Simpson’s rules, Romberg integration, Gaussian quadrature and orthogonal polynomials, multidimensional integrals, summation of series, Euler-Maclaurin summation formula, numerical differentiation and estimation of errors. Optimization: Extremization of functions, simple search, Nelder-Mead simplex method, Powell’s method, gradient-based methods, simulated annealing. Complex analysis: Complex numbers, functions of a complex variable, analytic functions, conformal mapping, Cauchy’s theorem. Calculus of residues. Fourier and Laplace Transforms, Discrete Fourier Transform, z transform, Fast Fourier Transform (FFT), multidimensional FFT, basics of numerical optimization."
http://cds.iisc.ac.in/admissions/course-degrees/,Data Analysis and Visualization,,"Data pre-processing, data representation, data reconstruction, machine learning for data processing, convolutional neural networks,  visualization pipeline, isosurfaces, volume rendering, vector field visualization, applications to biological and medical data, OpenGL, visualization toolkit, linear models, principal components, clustering, multidimensional scaling, information visualization."
http://cds.iisc.ac.in/admissions/course-degrees/,Research Methods - Softs Skills Course,This course will develop the soft skills required for the CDS students.,"Seminar attendance, literature review, technical writing (reading, writing, reviewing), technical presentation, CV/resume preparation, grant writing, Intellectual property generation (patenting), incubation/start-up opportunities, and academia/industry job search"
https://eecs.iisc.ac.in/mtechai/,Data Structures and Algorithms,,
https://eecs.iisc.ac.in/mtechai/,Stochastic Models and Applications,,
https://eecs.iisc.ac.in/mtechai/,Random Processes,,
https://eecs.iisc.ac.in/mtechai/,Computational Linear Algebra,,
https://eecs.iisc.ac.in/mtechai/,Computational Methods of Optimization,,
https://eecs.iisc.ac.in/mtechai/,Pattern Recognition and Neural Networks,,
https://eecs.iisc.ac.in/mtechai/,Foundations of Machine Learning,,
https://eecs.iisc.ac.in/mtechai/,Machine Learning,,
https://www.nitt.edu/home/academics/departments/ca/programmes/mtech/,Statistical Computing,"Implement statistical analysis techniques for solving practical problems.
Perform statistical analysis on variety of data.
Perform appropriate statistical tests using R and visualize the outcome.","Probability Theory: Sample Spaces- Events - Axioms – Counting - Conditional Probability and Bayes’ Theorem – The Binomial Theorem – Random variable and distributions : Mean and Variance of a Random variable-Binomial-Poisson-Exponential and Normal distributions. Curve Fitting and Principles of Least Squares- Regression and correlation. Sampling Distributions & Descriptive Statistics: The Central Limit Theorem, distributions of the sample mean and the sample variance for a normal population, Sampling distributions (Chi-Square, t, F, z). Test of Hypothesis- Testing for Attributes – Mean of Normal Population – One-tailed and two-tailed tests, F-test and Chi-Square test - - Analysis of variance ANOVA – One way and two way classifications. Tabular data- Power and the computation of sample size- Advanced data handling_x0002_Multiple regression- Linear models- Logistic regression- Rates and Poisson regression_x0002_Nonlinear curve fitting. Density Estimation- Recursive Partitioning- Smoothers and Generalised Additive Models - Survivals Analysis- Analysing Longitudinal Data- Simultaneous Inference and Multiple Comparisons- Meta-Analysis- Principal Component Analysis- Multidimensional Scaling_x0002_Cluster Analysis. Introduction to R- Packages- Scientific Calculator- Inspecting Variables- Vectors_x0002_Matrices and Arrays- Lists and Data Frames- Functions- Strings and Factors- Flow Control and Loops- Advanced Looping- Date and Times. Introduction to Python_x0002_Packages- Fundamentals of Python- Inserting and Exporting Data- Data Cleansing_x0002_Checking and Filling Missing Data- Merging Data- Operations- Joins."
https://www.nitt.edu/home/academics/departments/ca/programmes/mtech/,Big Data Analytics,Work with big data platform and explore the big data analytics techniques business applications.  Design efficient algorithms for mining the data from large volumes.  Analyze the HADOOP and Map Reduce technologies associated with big data analytics.  Explore on Big Data applications Using Pig and Hive.  Understand the fundamentals of various big data analytics techniques.  Build a complete business data analytics solutio,Introduction to big data : Introduction to Big Data Platform – Challenges of Conventional Systems - Intelligent data analysis – Nature of Data - Analytic Processes and Tools - Analysis vs Reporting. Mining data streams : Introduction To Streams Concepts – Stream Data Model and Architecture - Stream Computing - Sampling Data in a Stream – Filtering Streams – Counting Distinct Elements in a Stream – Estimating Moments – Counting Oneness in a Window – Decaying Window - Real time Analytics Platform(RTAP) Applications - Case Studies - Real Time Sentiment Analysis- Stock Market Predictions. Hadoop: History of Hadoop- the Hadoop Distributed File System – Components of Hadoop Analysing the Data with Hadoop- Scaling Out- Hadoop Streaming- Design of HDFS-Java interfaces to HDFS Basics- Developing a Map Reduce Application-How Map Reduce Works-Anatomy of a Map Reduce Job run-Failures-Job Scheduling-Shuffle and Sort – Task execution - Map Reduce Types and Formats- Map Reduce Features_x0002_Hadoop environment. Frameworks: Applications on Big Data Using Pig and Hive – Data processing operators in Pig – Hive services – HiveQL – Querying Data in Hive - fundamentals of HBase and ZooKeeper - IBM InfoSphere BigInsights and Streams. Predictive Analytics- Simple linear regression- Multiple linear regression- Interpretation5 of regression coefficients. Visualizations - Visual data analysis techniques- interaction techniques - Systems and applications.
https://www.nitt.edu/home/academics/departments/ca/programmes/mtech/,Machine Learning Techniques,Select real-world applications that needs machine learning based solutions. Implement and apply machine learning algorithms.  Select appropriate algorithms for solving a particular group of real-world problems. Recognize the characteristics of machine learning techniques that are useful to solve real-world problems.,Introduction- overview of machine learning- Different forms of learning- Generative6 learning- Gaussian parameter estimation- maximum likelihood estimation- MAP estimation- Bayesian estimation- bias and variance of estimators- missing and noisy features- nonparametric density estimation- applications- software tools. Classification Methods-Nearest neighbour- Decision trees- Linear Discriminant Analysis - Logistic regression-Perceptrons- large margin classification- Kernel methods- Support Vector Machines. Classification and Regression Trees. Graphical and sequential models- Bayesian networks- conditional independence_x0002_Markov random fields- inference in graphical models- Belief propagation- Markov models- Hidden Markov models- decoding states from observations- learning HMM parameters. Clustering Methods-Partitioned based Clustering - K-means- K-medoids; Hierarchical Clustering - Agglomerative- Divisive- Distance measures; Density based Clustering - DBScan; Spectral clustering. Neural networks- the perceptron algorithm- multilayer perceptron’s- back propagation_x0002_nonlinear regression- multiclass discrimination- training procedures- localized network structure- dimensionality reduction interpretation.
https://www.nitt.edu/home/academics/departments/ca/programmes/mtech/,Big Data Management and Data Analytics Lab,"Preparing for data summarization, query, and analysis.  Applying data modelling techniques to large data sets  Creating applications for Big Data analytics  Building a complete business data analytic solution",
https://www.nitt.edu/home/academics/departments/ca/programmes/mtech/,Real Time Systems,Gain Knowledge about Schedulability analysis.  Learn about the Real-time programming environments.  Attain knowledge about real time communication and databases.  Develop real time systems.,"Introduction to real time computing - Concepts; Example of real-time applications – Structure of a real time system – Characterization of real time systems and tasks - Hard and Soft timing constraints - Design Challenges - Performance metrics - Prediction of Execution Time : Source code analysis, Micro-architecture level analysis, Cache and pipeline issues- Programming Languages for Real-Time Systems Real time OS – Threads and Tasks – Structure of Microkernel – Time services – Scheduling Mechanisms Communication and Synchronization – Event Notification and Software interrupt Task assignment and Scheduling - Task allocation algorithms - Single-processor and9 Multiprocessor task scheduling - Clock-driven and priority-based scheduling algorithms_x0002_Fault tolerant scheduling Real Time Communication -Network topologies and architecture issues – protocols – contention based, token based, polled bus, deadline based protocol, Fault tolerant routing. RTP and RTCP. Real time Databases – Transaction priorities – Concurrency control issues – Disk scheduling algorithms – Two phase approach to improve predictability."
https://www.nitt.edu/home/academics/departments/ca/programmes/mtech/,Next Generation Databases,Explore the relationship between Big Data and NoSQL databases  Work with NoSQL databases to analyze the big data for useful business applications.  Work with different data models to suit various data representation and storage needs.,Database Revolutions- System Architecture- Relational Database- Database Design_x0002_Data Storage- Transaction Management- Data warehouse and Data Mining- Information Retrieval. Big Data Revolution- CAP Theorem- Birth of NoSQL- Document Database—XML Databases- JSON Document Databases- Graph Databases. Column Databases— Data Warehousing Schemes- Columnar Alternative- Sybase IQ- C_x0002_Store and Vertica- Column Database Architectures- SSD and In-Memory Databases— In_x0002_Memory Databases- Berkeley Analytics Data Stack and Spark. Distributed Database Patterns— Distributed Relational Databases- Non-relational10 Distributed Databases- MongoDB - Sharing and Replication- HBase- Cassandra_x0002_Consistency Models— Types of Consistency- Consistency MongoDB- HBase Consistency- Cassandra Consistency. Data Models and Storage- SQL- NoSQL APIs- Return SQL- Advance Databases— PostgreSQL- Riak- CouchDB- NEO4J- Redis- Future Databases— Revolution Revisited_x0002_Counter revolutionaries- Oracle HQ- Other Convergent Databases- Disruptive Database Technologies
https://www.nitt.edu/home/academics/departments/ca/programmes/mtech/,High Performance Computing,Investigate modern design structures of pipelined and multiprocessors systems.  Write algorithms using parallel programming principle.  Design the architecture of parallel systems.,Principles of Parallel Algorithms- Graph Algorithms- Minimum Spanning Tree- Prim's Algorithm - Single-Source Shortest Paths-Dijkstra's Algorithm - All-Pairs Shortest Paths - -. Algorithms for Sparse Graphs - Search Algorithms for Discrete Optimization Problems - Sequential Search Algorithms - - Parallel Depth-First Search - Parallel Breadth-First Search - Dynamic Programming - Serial Monadic DP Formulations –No serial Monadic DP Formulations - Serial Polyadic DP Formulations. Shared-memory parallel programming with OpenMP- Introduction to OpenMP - Parallel11 execution - Data scoping -OpenMP work sharing for loops - Synchronization Reductions - Loop scheduling - Miscellaneous - Case study-OpenMP-parallel Jacobi algorithm - Advanced OpenMP-Wavefront parallelization - Efficient OpenMP programming - Profiling OpenMP programs. Distributed-memory parallel programming with MPI- Message passing- MPI – example - Messages and point-to-point communication - Collective communication - Non blocking point-to-point communication - Virtual topologies - Example- MPI parallelization of Jacobi solver - Communication parameters -Synchronization_x0002_serialization- contention - Implicit serialization and synchronization - Contention - Reducing communication overhead - Optimal domain decomposition - Aggregating messages - Non blocking vs. asynchronous communication. Hybrid parallelization with MPI and OpenMP- Basic MPI/OpenMP programming models - Vector mode implementation - Task mode implementation - Case study- Hybrid Jacobi solver - MPI taxonomy of thread interoperability - Hybrid decomposition and mapping - Potential benefits and drawbacks of hybrid programming. NVidia – GPU Computing – CUDA – Case studies.
https://www.nitt.edu/home/academics/departments/ca/programmes/mtech/,Machine Learning Lab,Implement and apply machine learning algorithms to solve problems.  Select appropriate algorithms for solving a of real-world problems.  Use machine learning techniques in high-performance computing environment to solve real-world problems.,
https://www.iiitd.ac.in/academics/mtech/ai,Artificial Intelligence,"This is an introductory course in Artificial Intelligence. This course introduces the students to various search techniques, knowledge representation, reasoning, and learning. Students are able to apply basic search techniques for problem solving.Students are able to explain how to represent Knowledge required for problem solving.Students are able to apply reasoning to sift through data.Students are able to utilize AI for application in real world.","Introduction to AI, Knowledge representation using Predicate Logic, 	Blind search and search based on heuristics, Search using constraint satisfaction, 	Adversarial Search (Game playing), Knowledge representation using Frames and Conceptual Dependency, Nature inspired search algorithms, Probabilistic Reasoning: Bayesian Network, Dempser Shafer, Fuzzy Logic, 	Learning: Linear Regression, Perceptron, Neural Networks, 	Planning and Reinforcement Learning, Knowledge representation: Natural Language Processing, Applications"
https://www.iiitd.ac.in/academics/mtech/ai,Introduction to Graduate Algorithms,"Students are able to design and analyse algorithms using techniques like divide and conquer, greedy and dynamic programming. Students are able to use standard data structures like heaps, trees and graphs for designing algorithms.Students are able to prove NP- completeness of problems using reductions.Students are able to state modern techniques to handle intractable problems like randomization, approximation, backtracking search","Review: Discrete mathematics, 	Data structures: Heap, Hash table, Disjoint-set, 	Greedy Algorithm, 	Divide and conquer, Dynamic programming, 	Graph Algorithms, 	NP-completeness, Modern techniques for intracatable problems"
https://www.iiitd.ac.in/academics/mtech/ai,Modern Algortihm Design,"Students are able to use algorithm design techniques in applications where data is imprecise, unavailable or arriving over time. Students are able to use techniques such as randomization, network flows, etc. to design efficient algorithms and heuristics.Students are able to use
appropriate data structures that help solving algorithmic problems efficiently. Students are able to explain
different approaches of dealing with NP-hard optimization problems.","Randomization, 	Skip list and hashing, 	Amortized Analysis and Disjoint Set, Suffix tree and suffix array, 	Linear programming, 	Maximum flow algorithms, Bipartite matching and stable matching, Approximation algorithms, Parallel and external-memory algorithms, 	Online Algorithms, Streaming algorithms, 	Data compression algorithms, Web search algorithms"
https://www.iiitd.ac.in/academics/mtech/ai,Statistical Machine Learning,"Students will be able to understand the various key paradigms for machine learning and pattern classification. Students will be able to apply suitable feature extraction and classification technique to solve a given pattern classification problem. Students will be able to design a
complete machine learning/pattern classification algorithm and evaluate the performance. ","Mathematical review, Introduction to Pattern Recognition and Evaluation Metrics, Bayesian Decision Theory, 	Parameter Estimation, , 	Discriminant Analysis: PCA, LDA, ICA, , Parameter Estimation: MLE, MAP, EM, ,	Non-parametric Estimation - Voronoi, Parzen Windows,  Hidden Markov Models, 	Neural Networks, 	Ensembles: Bagging, Boosting, Consistency of classifiers, Unsupervised Learning, Non-parametric Regression"
https://www.iiitd.ac.in/academics/mtech/ai,Machine Learning,"Explain the different types of learning problems along with some techniques to solve them. 	Model real-world problems, apply different learning techniques and quantitatively evaluate the performance. Identify and use advanced techniques through existing machine learning tools and libraries. Analyze performance of ML techniques and comment on their limitations","Introduction to Machine Learning; Learning Problems and the Risk Minimization Framework, Classification: Naïve Bayes; k-Nearest Neighbors; Decision Trees; Regression: Linear Models, 	Linear Models for Regression & Classification: Linear and Logistic Regression; Practical
Machine Learning: Bias-Variance; Training/Testing; Overfitting; Jackknifing/Cross-Validation; Occam's razor; Regularization and Model Selection, 	Perceptron and Support Vector Machines (primal & dual form.), 	Soft-Margin SVMs; Kernel Methods, 	MLP and Neural Networks, Backpropagation, 		CNN for Image Classification, Object Detection; PCA, Autoencoders and Generative Models, Introduction to Reinforcement Learning (MDPs); Bellman Equation and Dynamic Programming; Value and Policcy Iteration, 	Q-Learning; DQN;
Ensemble Methods: Bagging, Boosting and Adaboost, 	Random Forests;
Unsupervised Learning: k-means clustering; Gaussian Mixture Models; EM, Evolutionary Algorithms; Learning Theory (if time permits)"
http://dcsku.org/MSC%20AI.php,Mathematics of Artificial Intelligence,CO1 Find the relationship between the vectors by the help of vector algebra CO2 Prioritize the components of a matrix with the help of Eigenvalues & eigenvectors CO3 Articulate the concept and derivation of gradients CO4 Describe the role of local-global maxima & minima Gradient algorithms optimization CO5 State the basics conditional probability and its applications CO6 Illustrate the use of Information theory in machine learning algorithms,"MODULE I: Linear Algebra –Review of basic ideas of Vectors and its operations, cosine similarity, orthogonal vectors. Review of vector norms, Vector space and basis, Spanning sets, Linear independence, Bases and Dimension. MODULE II: Matrices, Hadamard product, linear transformation, identity matrix, invertible matrix and inverse, rank, Type of matrices- symmetric, diagonal, orthogonal, orthonormal, positive definite matrix. MODULE III: Calculus – review of Functions, rules of differentiation, partial derivatives, Gradient concept, intuition properties, directional derivative. MODULE IV: Vector and matrix calculus, Eigenvalues & eigenvectors, Jacobian Gradient algorithms,local-global maxima and minima, saddle point, convex functions, gradient descent algorithms- batch, mini-batch, stochastic.MODULE V: Probability - Basic rules and axioms, events, sample space, frequentist approach, dependent and independent events, conditional probability, Random variables- continuous and discrete, expectation, variance. MODULE VI: Distributions- joint and conditional, Bayes’ Theorem, Distributions_x0002_binomial, bernoulli, gaussian. Basics of Information theory- entropy, cross-entropy, mutual information."
http://dcsku.org/MSC%20AI.php,Autonomous Systems and Knowledge Representation,"CO1 Discuss Artificial Intelligence including topics, branches, and applications. CO2 Explain the significance of intelligent agents in the Artificial Intelligence. CO3 Discuss about knowledge representation and its structures. CO4 Compare different reasoning methods and Bayesian networks. CO5 Compare different association rule mining algorithms. CO6 Illustrate how Artificial Intelligence works in Gaming applications (basics only). CO7 Explain the principles, components, operations and other technological advancements in Robotics. CO8 Evaluate a selected robotic expert system and discuss its working principle.","MODULE I: Topics of Artificial Intelligence, Timelines of Artificial Intelligence, Branches of Artificial Intelligence, Applications of Artificial Intelligence. - Intelligent agents - structure, types of agents, environment, autonomous agents. Problem Solving - Production Systems, State space representation. MODULE II: Knowledge Representation - Knowledge Management, Types of Knowledge, Knowledge representation-bases and structures - First Order logic, Unification algorithm, Frames, Conceptual Dependency, Scripts, Semantic network MODULE III: Reasoning - Types of reasoning, Non-monotonic reasoning, reasoning with Fuzzy logic, Rule Based reasoning, Case Based reasoning, Model based reasoning systems. - Bayes rule, Bayesian networks, probabilistic inference, sample applications MODULE IV: Game playing - Minimax procedure, Alpha-Beta pruning, combined approach, Iterative Deepening. MODULEV: Expert systems - characteristics, components. Expert system development, knowledge engineering, application of expert systems. Case studies in expert systems. MODULE VI: Robotics – principles and components, operations, mathematics of robotics, line flow robot, applications of robots, case studies in robotics."
