https://annamalaiuniversity.ac.in/studport/download/Handbook/2020-21/cis/M.Sc._Data_Science_2019_2020.pdf,Big Data Analytics,CO1 Identify the characteristics of datasets for various applications. CO2 To Select environment and methodologies for the applications. CO3 To Solve problems associated with big data characteristics concepts. CO4 To integrate mathematical and statistical tools with modern technologies like Hadoop and Map reduce CO5 To Provide better solutions and develop applications to the problem associated with big data Techniques,"Unit 1 - Introduction to Big Data: Introduction to Big Data Platform – Traits of Big data - Challenges of Conventional Systems - Web Data – Evolution Of Analytic Scalability - Analytic Processes and Tools - Analysis Vs Reporting - Modern Data Analytic Tools - Statistical Concepts: Sampling Distributions - Re-Sampling - Statistical Inference - Prediction Error. Unit 2 - Data Analysis: Regression Modeling - Multivariate Analysis - Bayesian Modeling - Inference and Bayesian Networks - Support Vector and Kernel Methods - Analysis of Time Series: Linear Systems Analysis - Nonlinear Dynamics - Rule Induction - Neural Networks: Learning And Generalization - Competitive Learning - Principal Component Analysis and Neural Networks - Fuzzy Logic: Extracting Fuzzy Models from Data - Fuzzy Decision Trees - Stochastic Search Methods. Unit 3 - Mining Data Streams: Introduction To Streams Concepts – Stream Data Model and Architecture - Stream Computing - Sampling Data in a Stream – Filtering Streams – Counting Distinct Elements in a Stream – Estimating Moments – Counting Oneness in a Window – Decaying Window - Real time Analytics Platform(RTAP) Applications - Case Studies - Real Time Sentiment Analysis, Stock Market Predictions. Unit 4 - Frequent Itemsets and Clustering: Mining Frequent Item sets - Market Based Model – Apriori Algorithm – Handling Large Data Sets in Main Memory – Limited Pass Algorithm – Counting Frequent Item sets in a Stream – Clustering Techniques – Hierarchical – K-Means – Clustering High Dimensional Data – CLIQUE And PROCLUS – Frequent Pattern based Clustering Methods – Clustering in Non-Euclidean Space – Clustering for Streams and Parallelism. Unit 5 - Hadoop and R for Visualization: Back ground and fundamentals-moving data in and out of Hadoop-data serialization-applying Map Reduce patterns to big data- streaming big data_x0002_integrating R and Hadoop for statistics and more-predictive analytics with Mahout- Hacking with Hive-Programming pipelines with pig – HBase- MySQL -NoSQL- RHadoop."
https://annamalaiuniversity.ac.in/studport/download/Handbook/2020-21/cis/M.Sc._Data_Science_2019_2020.pdf,Software Project Management,"CO1 Analyze the scope, cost, timing, and quality of the project, at all times focused on project success as defined by project stakeholders. CO2 Align the project to the organization's strategic plans and business justification throughout its lifecycle. CO3 Identify project goals, constraints, deliverables, performance criteria, control needs, and resource requirements in consultation with stakeholders. CO4 Implement project management knowledge, processes, lifecycle and the embodied concepts, tools and techniques in order to achieve project CO5 Adapt projects in response to issues that arise internally and externally.","Unit 1 - Project Management Framework: Introduction: Project - Project management - Relationship among Project, Program and Portfolio management - Project and operations management- Role of project manager - Project management body of knowledge - Enterprise Environmental factors. Project life cycle and Organization: Overview of project life cycle - Projects vs Operational Work - Stakeholders - Organizational influences on project management. The Standard for Project Management of a Project: Project management processes for a project: Common project management process interactions - Projects management process groups - Initiating process group - planning process group - Executing process group - Monitoring and controlling process group - Closing process group. Unit 2 - Choosing Methodologies and Technologies – Software Processes and Process Models – Choice of Process Models – The Waterfall Model– Prototyping – other ways of categorizing prototype - Agile Methods – Extreme Programming Selecting the Most Appropriate Process Model- Need of Agile - Iterative vs Incremental-Agile Manifesto and Mindset – Lean, Scrum and Kanban methods-uncertainty, Risk, and lifecycle selection-Scrum Elements overview-5 levels of planning-Scrum Process overview-Agile Team-roles and responsibilities- Epic-feature-User Stories-PBI-The Sprint. Unit 3 - The Project Management Knowledge Areas: Project integration management: Develop project charter - Develop project management plan - Direct and manage project execution - Monitor and control project work - Perform integrated change control - Close project or phase. Project scope management: Collect requirements - Define Scope - Create WBS - Verify Scope - Control Scope. Project team management: Define activities - Sequence activities - Estimate activity resources - Estimate Activity Durations - Develop Schedule - Control Schedule. Unit 4 - Project cost management: Estimate costs - Determine budget - Control costs. Project Quality Management: Plan quality - perform quality assurance - Perform quality control. Project Human Resource Management: Develop human resource plan - Acquire project team - Develop project team - Manage project team. Project Communications Management: Identify stakeholders - Plan communications - Distribute information - Manage stakeholder expectations - report performance. Unit 5 - Project Risk Management: Plan risk management - Identify risks - Perform qualitative risk analysis - Perform quantitative risk analysis - plan risk responses - Monitor and control risks. Project Procurement Management: Plan - Conduct - Administer - Close procurements."
https://annamalaiuniversity.ac.in/studport/download/Handbook/2019-20/Arts/ABUS27_BA2019.pdf,Management Concepts and Organizational Behaviour,,
https://annamalaiuniversity.ac.in/studport/download/Handbook/2019-20/Arts/ABUS27_BA2019.pdf,Introduction to Business Analytics,"CO1: Critically analyze the business problems and apply analytical knowledge in big data CO2: Recognize, understand and apply the language, theory and models of the field of business analytics CO3: Able to cultivating cognitive skills on the applications of business analytics. CO4: Commitment to sustainable development of data visualization and time series analysis related to various sectors. CO5: Provide leadership in application of using R statistics CO6: Cultivating cognitive skills acquired on forecasting methods","Unit-1 Introduction to Business Analytics and Big Data (12 h)
Business Analytics – Definition - Need – Scope - A categorization of Analytical Methods – Analytics 
in action – Big data – Business analytics in practice – types of data – modifying data in excel –
creating Distributions from data– measures of location 15
Unit-2 Application of Business Analytics (10 h)
Machine Learning - Introduction and Concepts - Differentiating algorithmic and model based 
frameworks, Decision analytics. Descriptive analytics - Predictive analytics - Prescriptive analytics. 
Unit-3 Decision support and Data Visualisation (12 h)
DSS- Executive and enterprise support- Automated decision support - Web analytics- Data mining 
-Applied artificial intelligence - Visual analysis: Data concepts – Data Dashboards - Data 
exploration & visualization - Scorecards
Unit-4 Time Series and Forecasting (14 h)
Time series pattern – forecasting accuracy – moving averages and exponential smoothing - using 
regression analysis for forecasting – determining the best forecasting model to use - building good 
spreadsheet model – What-If analysis – some useful excel functions for modeling – auditing 
spreadsheet model – a simple maximization problem. 
Unit-5 Data Analysis using R (12 h)
R Studio: Introduction – R data types and objects, reading and writing data - Data structures in R -
R programming fundamentals - Advantages and disadvantages of using R. “Current Streams of 
Thought”."
https://annamalaiuniversity.ac.in/studport/download/Handbook/2019-20/Arts/ABUS27_BA2019.pdf,Accounting for Managers,,
https://annamalaiuniversity.ac.in/studport/download/Handbook/2019-20/Arts/ABUS27_BA2019.pdf,Statistical Decision Making,"CO1: Develop expertise in describing data, cultivating aptitude for research design, hypothesis testing and model building CO2: Increase their capability as a manager to think statistically using data CO3: Apply cognitive skills to support the data collection methods to solve the problems CO4: Provide experience in statistical methods in decision making process CO5: Cultivating cognitive skills acquired on using the parametric and non-parametric tools for various service sectors. CO6: Apply analytical knowledge in business statistics for sustainable development of an organisation",Unit-1 Introduction to Research (10 h) Research – Meaning – Types – Nature and scope of research – Problem formulation – Statement of research Objective –Importance of research in Management – Research process – Research designs18 Unit-2 Data Collection Methods (10 h) Data Collection Methods of data collection – Observational and Survey methods – Field surveys – Sampling methods & techniques – Sample size Unit-3 Research Tools (12 h) Sources of Data – Primary – Secondary data – Questionnaire Design; Attitude measurement techniques – Scaling Techniques - Simple Tabulation and Cross Tabulation– Frequencies – Percentage – Charts Unit-4 Parametric Tools (14 h) Introduction to Statistics – Estimation of Population parameters – Point of Internal estimates of means and proportions – Correlation – Regression – Hypothesis testing –t test – F test – Two way ANOVA – Discriminant Analysis – Factor analysis - Cluster Analysis Unit-5 Non-Parametric Tools (14 h) Scale Validation - Normality Test - Chi–square test – 1-sample Wilcoxon signed rank test. - Friedman test - Kruskal-Wallis test - Mann-Whitney test - Spearman Rank Correlation. “Current Streams of Thought”
https://annamalaiuniversity.ac.in/studport/download/Handbook/2019-20/Arts/ABUS27_BA2019.pdf,E-business management,"CO1: CO1: Critically thinking on import, manage and structure data files for using business analytics. CO2: CO2: Apply analytical knowledge with the R interface and language for different fields. CO3: CO3: Provide leadership in analytics in existing datasets into R or create new ones CO4: CO4: Cultivating cognitive skills acquired on existing data and performs all conventional statistical analysis tests CO5: CO5: Capable to analyze problems using R knowledge on data management for sustainable development of the organisation. CO6: CO6: Effectively solve business problems and make effective decision making using R Statistics.","Unit-1 Introduction to the R language (12 h) Introduction to the R language - SAS versus R - R, S, and S-plus - Obtaining and managing R - Objects - types of objects, classes, creating and accessing objects - Arithmetic and matrix operations - Introduction to functions. Unit-2 Working with R (12 h) Working with R - Reading and writing data - R libraries - Functions and R programming – the If statement - looping: for, repeat, while - writing functions - function arguments and options – Basic R commands Unit-3 Graphics (10 h) Graphics - Basic plotting - Manipulating the plotting window - Advanced plotting using lattice library - Saving plots. Unit-4 Standard statistical models in R (12 h) Standard statistical models in R - Model formulae and model options - Output and extraction from fitted models - Models considered:Linear regression: lm() , Logistic regression: glm() , Linear mixed models: lme()21 Unit-5 Advanced R (14 h) Advanced R - Data management - importing, sub-setting, merging, new variables, missing data; Plotting – Loops and functions - Migration SAS to R – Plotting and Graphics in R – Writing R functions, optimizing R code– Bio-conductor, analysis of gene expression and genomics data. More on linear models – Multivariate analysis, Cluster analysis, dimension reduction methods (PCA). “Current Streams of Thought”."
https://annamalaiuniversity.ac.in/studport/download/Handbook/2019-20/Arts/ABUS27_BA2019.pdf,Introduction to R Lab,,
https://annamalaiuniversity.ac.in/studport/download/Handbook/2019-20/Arts/ABUS27_BA2019.pdf,Spread Sheet Modelling,"CO1: Perform, recognize and formulate business problems in using Excel spreadsheets CO2: Evaluate or solve Excel spreadsheet models using professional software CO3: Apply analytical knowledge in the concepts and techniques of spread sheets to solve the real-world business situations and take effective decisions CO4: Critically thinking and compare the applications of Spread sheet modeling in real life situation CO5: Use cognitive skills to the application of t-test and ANOVA through spread sheet and develop competitive edge for a large corporate. CO6: Capable to analyze problems using spread sheet modeling in Finance, HR and Marketing fields.","Unit-1 Introduction to Spread sheet Modeling (12 h) Formulas/Formatting/Printing/Functions Cell references, Lookup tables, Linking disparate work books, Dynamic, linking, updating links, data validation, Goal seek, Pivottable, Sorting Charting and filtering and protecting spread sheets Unit-2 Spread Sheet Modeling in Sales and Marketing: (12 h) New product decision making–Sales and marketing data analysis Unit-3 Spreadsheet Modeling in Finance (12 h) Forecasting financial statements – NPV & IRR, Bond valuation, Stock valuation - Fundamentals, Budgeting, Ratio analysis Unit-4 Spreadsheet Modeling in Statistics (12 h) Measures of central tendency, t test, ANOVA, Correlation, Regression and Time series Unit-5 Spread Sheet Modeling In Production and Human Resource (12 h) ABC analysis, Economic Order Quantity, Production budget – Employee payroll decision making. “Current Streams of Thought”."
https://annamalaiuniversity.ac.in/studport/download/Handbook/2019-20/Arts/ABUS27_BA2019.pdf,Marketing & CRM,"CO1: Acquire required skills in solving marketing related problems and challenges CO2: Analyse the relevance of Marketing concepts and theories in evaluating environmental changes on marketing planning, strategies and practices CO3: Determine strategies for developing new products and services that are consistent with evolving market needs CO4: Formulate marketing plan and employ digital tools to analyze the effectiveness of a marketing campaign CO5: Understand the implementation of CRM best practices and customer relationships CO6: Work professionally in CRM team and exhibit leadership skills","Unit-1 Introduction of Marketing (12 h) Definition of Market, Types of Markets, Meaning and Definition of Marketing, Scope of Marketing, Importance of Marketing, Functions of Marketing, Difference between Marketing and Selling– Market Leader Strategies – Market follower Strategies – Market Challenger Strategies and Market Niche Strategies - Demand forecasting methods - Market Segmentation –Target Marketing – Product differentiation – Market Positioning Strategy. Unit-2 Marketing Mix – Product & Price (12 h) Product – Classification of consumer goods and Industrial goods – Product lines – Product Life Cycle – New Product Development – Launching New Product – Product Innovation; Brand – Types; Packaging – Labelling Trade Marks – Copyrights – Patents. Pricing Strategy – Methods of Setting Price. Unit-3 Marketing Mix - Physical Distribution and Promotion (12 h) Marketing Channels – Direct Marketing – Industrial Marketing – Network Marketing – e–marketing – B2B – B2C – Distribution Network – Channel Management – Retailing – Wholesaling – Advertising – Publicity – Trade Promotion and Sales Promotion Methods. Unit-4 CRM in Marketing (12 h) One-to-one Relationship Marketing – Cross Selling & Up Selling – Customer Retention, Behaviour Prediction – Customer Profitability & Value Modeling, - Channel Optimization – Event-based marketing. – CRM and Customer Service – The Call Centre, Call Scripting – Customer Satisfaction Measurement. Unit-5 Analytical CRM (12 h) Managing and sharing customer data - Customer information 2 databases - Ethics and legalities of data use - Data Warehousing and Data Mining concepts - Data analysis - Market Basket Analysis (MBA), Click stream Analysis, Personalization and Collaborative Filtering. “Current Streams of Thought”."
https://annamalaiuniversity.ac.in/studport/download/Handbook/2019-20/Arts/ABUS27_BA2019.pdf,Business Strategy,CO1: Capture data from internet and other sources CO2: Plot data using appropriate Python visualization libraries CO3: Create and execute Pythton programs CO4: Interpret Object Oriented Programming using Python CO5: Design and program Python applications CO6: Adapt and combine standard algorithms to solve problems,"Unit-1 Introduction to Python (12 h) Knowledge, Machines, Languages, Types, Variables Operators and Branching -– Core elements of programs: Bindings, Strings, Input/Output, IDEs, Control Flow, Iteration, Guess and Check – Simple Programs: Approximate Solutions, Bisection Search, Floats and Fractions Newton - Raphson – Functions: Decomposition and Abstraction, Functions and Scope, Keyword Arguments, Specifications, Iteration vs Recursion, Inductive Reasoning, Towers of Hanoi, Fibonacci, Recursion on non-numerics, Files Unit-2 Tuples and Lists (12 h) Tuples, Lists, List Operations, Mutation, Aliasing, Cloning – Dictionaries: Functions as Objects, Dictionaries , Example with a Dictionary, Fibonacci and Dictionaries, Global Variables – Debugging: Programming Challenges, Classes of Tests, Bugs, Debugging, Debugging Examples– Assertions and Exceptions, Assertions, Exceptions, Exception Examples Unit-3 Classes and Inheritance (12 h) Object Oriented Programming, Class Instances, Methods Classes Examples , Why OOP, Hierarchies, Your Own Types – An Extended Example: Building a Class, Visualizing the Hierarchy, Adding another Class, Using Inherited Methods, Grade book Example, Generators27 Unit-4 Computational Complexity (12 h) Program Efficiency, Big Oh Notation, Complexity Classes Analyzing Complexity – Searching and Sorting Algorithms: Indirection, Linear Search, Bisection Search, Bogo and Bubble Sort, Selection Sort, Merge Sort Unit-5 Optimization and Knapsack Problem (12 h) Computational models, Intro to optimization - Knapsack Problem, Greedy solutions – Decision Trees and Dynamic Programming: Decision tree solution to knapsack Dynamic programming and knapsack, Divide and conquer – Graphs: Graph problems, Shortest path, Depth first search, Breadth first search. “Current Streams of Thought”."
https://annamalaiuniversity.ac.in/studport/download/Handbook/2019-20/Arts/ABUS27_BA2019.pdf,Python Lab,,
https://annamalaiuniversity.ac.in/studport/download/Handbook/2019-20/Arts/ABUS27_BA2019.pdf,Time Series Forecasting,CO1: Understand the various forecasting techniques and its advantages CO2: Generate prediction equations to predict business behaviour based on critical inputs CO3: Appreciate the fundamental advantage and necessity of forecasting in various situations CO4: Apply knowledge to diagnose and solve problems in diverse situations CO5: Choose an appropriate forecasting method in a particular environment CO6: Improve forecast with better statistical models based on statistics,"Unit-1 Introduction to Time Series Analysis (12 h) Utility of the Time Series , Components of Time Series - Long term trend or secular trend - Seasonal variations - Cyclic variations - Random variations, Methods of Measuring Trend - Free hand or graphic method - Semi-average method - Method of moving averages - Method of least squares. Unit-2 Models and Forecast for Time Series Data (12 h) Additive model - multiplicative model, Editing of Time Series, Measurement of Seasonal Variation - Seasonal average method - Seasonal variation through moving averages - Chain or link relative method -Ratio to trend method, Forecasting Methods Using Time Series - Mean forecast - Naive forecast - Linear trend forecast - Non-linear trend forecast - Forecasting with exponential smoothing. Unit-3 Vector Auto Regression Model (VAR) (12 h) Estimation and Identification, - Variance decomposition and Impulse response functions, - Causality applying Granger Causality Tests and VAR model, -Forecasting using a VAR model. Unit-4 Stochastic Process (12 h) Stochastic process and its main characteristics - Stochastic process - Time series as a discrete stochastic process – Stationarity - Main characteristics of stochastic processes (means, auto co_x0002_variation and autocorrelation functions) - Stationary stochastic processes - Stationarity as the main characteristic of stochastic component of time series. Unit-5 Linear Time Series (12 h) Moving Average Models, Autoregressive Models, Mixed Autoregressive and Moving Average Models, Homogeneous Non-Stationary Processes: ARIMA Models, Box-Jenkins Methodology, Specification of ARFMA Models, SARFMA, ARMAX Models. “Current Streams of Thought”."
https://annamalaiuniversity.ac.in/studport/download/Handbook/2019-20/Arts/ABUS27_BA2019.pdf,Data Visualization,"CO1: the basics of data visualization techniques namely Hadoop and Tableu CO2: working with data visualization techniques CO3: understanding the concepts related to Hadoop Ecosystem and Yarn CO4: getting exposure to Tableu user interface and data connection CO5: knowledge on groups and hierarchies in datasets CO6: distributing, sharing and exporting worksheets and dashboards","Unit-1 Introduction to HADOOP (12 h) Big Data – Apache Hadoop & Hadoop Eco System – Moving Data in and out of Hadoop – Understanding inputs and outputs of Map Reduce - Data Serialization Unit-2 HADOOP Architecture (12 h) Hadoop Architecture, Hadoop Storage: HDFS, Common Hadoop Shell commands , Anatomy of File Write and Read., Name Node, Secondary Name Node, and Data Node, Hadoop Map Reduce paradigm, Map and Reduce tasks, Job, Task trackers - Cluster Setup – SSH &Hadoop Configuration – HDFS Administering –Monitoring & Maintenance. Unit-3 HADOOP Ecosystem AND Yarn (12 h) Hadoop ecosystem components - Schedulers - Fair and Capacity, Hadoop 2.0 New Features Name Node High Availability, HDFS Federation, MRv2, YARN, Running MRv1 in YARN Unit-4 Introduction to TABLEAU (12 h) Introduction to Tableau 8 - Tableau User Interface - Basic Tableau Design Flow - Basic Visualization Design - Show Me! choosing Mark Types color - Size, and Shape Options - shaped Axis Charts-combination Charts - Measure Names - Measure Values - Data Connection - Connecting to Various Data Sources - Customizing Your View of the DataSets Unit-5 GROUPS – HIERARCHIES (12 h) Groups – Hierarchies - Extracting Data - Data Blending - Top 10 Chart - Bar Chart, Line Chart - Area Chart - Text Table/Cross Tab - Scatter Plot/Bubble Chart - Bullet Chart, Box Plot- Tree Map - Pie Chart - World Cloud - Tableau maps - Geocoded Fields - Dashboard Actions - Distributing and Sharing Your Dashboards - Exporting Worksheets and Dashboards Publishing to Tableau Server - Creating Tableau Server User Filters - Smartphones and Tablets with iOS and Android. “Current Streams of Thought”."
https://annamalaiuniversity.ac.in/studport/download/Handbook/2019-20/Arts/ABUS27_BA2019.pdf,e-Governance and Cyber Law,,
https://annamalaiuniversity.ac.in/studport/download/Handbook/2019-20/Arts/ABUS27_BA2019.pdf,Soft skills,,
https://annamalaiuniversity.ac.in/studport/download/Handbook/2019-20/Arts/ABUS27_BA2019.pdf,SQL Lab,"CO1: Analyzing foundational knowledge on SQL CO2: Managing all concepts of SQL, exception handling CO3: Understanding the process of using and managing functions CO4: The process of using, creating and managing packages CO5: Practicing various commands in SQL CO6: Effective communication with computers in machine language",
