https://www.brown.edu/graduateprograms/data-science-scm,Hands-on Data Science,"Develops all aspects of the data science pipeline: data acquisition and cleaning, handling missing data, data storage, exploratory data analysis, visualization, feature engineering, modeling, interpretation, presentation in the context of real-world datasets. Fundamental considerations for data analysis are emphasized (the bias-variance tradeoff, training, validation, testing). Classical models and techniques for classification and regression are included (linear regression, ridge and lasso regression, logistic regression, support vector machines, decision trees, ensemble methods). Uses the Python data science ecosystem.",
https://www.brown.edu/graduateprograms/data-science-scm,Data Engineering,"Provides an introduction to computer science and programming for data science. Coverage includes data structures, algorithms, analysis of algorithms, algorithmic complexity, programming using test-driven design, use of debuggers and profilers, code organization, and version control. Additional topics include data science web applications, SQL and no-SQL databases, and distributed computing.",
https://www.brown.edu/graduateprograms/data-science-scm,Statistical Learning,"A modern introduction to inferential methods for regression analysis and statistical learning, with an emphasis on application in practical settings in the context of learning relationships from observed data. Topics will include basics of linear regression, variable selection and dimension reduction, and approaches to nonlinear regression. Extensions to other data structures such as longitudinal data and the fundamentals of causal inference will also be introduced. At the end of the course, students will be able to (1) describe the statistical underpinnings of regression-based approaches to data analysis, (2) use R to implement basic and advanced regression analysis on real data, (3) develop written explanations of data analyses used to answer scientific questions in context, and (4) provide a critical appraisal of common statistical analyses, including choice of method and assumptions underlying the method.",
https://www.brown.edu/graduateprograms/data-science-scm,Deep Learning and Special Topics in Data Science,"A hands-on introduction to neural networks, reinforcement learning, and related topics. Students will learn the theory of neural networks, including common optimization methods, activation and loss functions, regularization methods, and architectures. Topics include model interpretability, connections to other machine learning models, and computational considerations. Students will analyze a variety of real-world problems and data types, including image and natural language data.",
https://www.brown.edu/graduateprograms/data-science-scm,Data and Society,"A course on the social, political, and philosophical issues raised by the theory and practice of data science. Explores how data science is transforming not only our sense of science and scientific knowledge, but our sense of ourselves and our communities and our commitments concerning human affairs and institutions generally. Students will examine the field of data science in light of perspectives provided by the philosophy of science and technology, the sociology of knowledge, and science studies, and explore the consequences of data science for life in the first half of the 21st century.",
https://www.brown.edu/graduateprograms/social-analysis-and-research-scm,Multivariate Statistical Methods,,
https://www.brown.edu/graduateprograms/social-analysis-and-research-scm,Qualitative Methods,,
https://www.brown.edu/graduateprograms/social-analysis-and-research-scm,Qualitative Methods of Investigation and Market Research,[Group of courses to choose from],
https://www.brown.edu/graduateprograms/social-analysis-and-research-scm,Spatial Analysis,[Group of courses to choose from],
https://www.brown.edu/graduateprograms/social-analysis-and-research-scm,Advanced Multivariate Methods for Population Analysis and Behavioral Modeling,[Group of courses to choose from],
https://www.bu.edu/met/degrees-certificates/ms-applied-data-analytics/,Foundations of Analytics with R,"The goal of this course is to provide students with the mathematical and practical background required in the field of data analytics. Probability and statistics concepts will be reviewed as well as the R tool for statistical computing and graphics. Different types of data are investigated along with data summarization techniques and plotting. Data populations using discrete, continuous, and multivariate distributions are explored. Errors during measurements and computations are analyzed in the course. Confidence intervals and hypothesis testing topics are also examined. The concepts covered in the course are demonstrated using R.",
https://www.bu.edu/met/degrees-certificates/ms-applied-data-analytics/,Data Analysis and Visualization with R,"This course provides an overview of the statistical tools most commonly used to process, analyze, and visualize data. Topics include simple linear regression, multiple regression, logistic regression, analysis of variance, and survival analysis. These topics are explored using the statistical package R, with a focus on understanding how to use and interpret output from this software as well as how to visualize results. In each topic area, the methodology, including underlying assumptions and the mechanics of how it all works along with appropriate interpretation of the results, are discussed. Concepts are presented in context of real world examples.",
https://www.bu.edu/met/degrees-certificates/ms-applied-data-analytics/,Analysis of Algorithms,"Discusses basic methods for designing and analyzing efficient algorithms emphasizing methods used in practice. Topics include sorting, searching, dynamic programming, greedy algorithms, advanced data structures, graph algorithms (shortest path, spanning trees, tree traversals), matrix operations, string matching, NP completeness.",
https://www.bu.edu/met/degrees-certificates/ms-applied-data-analytics/,Data Science with Python,"Students will learn major Python tools and techniques for data analysis. There are weekly assignments and mini projects on topics covered in class. These assignments will help build necessary statistical, visualization and other data science skills for effective use of data science in a variety of applications including finance, text processing, time series analysis and recommendation systems. In addition, students will choose a topic for a final project and present it on the last day of class.",
https://www.bu.edu/met/degrees-certificates/ms-applied-data-analytics/,Web Analytics and Mining,"The Web Analytics and Mining course covers the areas of web analytics, text mining, web mining, and practical application domains. The web analytics part of the course studies the metrics of web sites, their content, user behavior, and reporting. The text mining module covers the analysis of text including content extraction, string matching, clustering, classification, and recommendation systems. The web mining module studies how web crawlers process and index the content of web sites, how search works, and how results are ranked. Application areas mining the social web will be extensively investigated.",
https://www.bu.edu/met/degrees-certificates/ms-applied-data-analytics/,Data Mining,"The goal of this course is to study basic concepts and techniques of data mining. The topics include data preparation, classification, performance evaluation, association rule mining, and clustering. We will discuss basic data mining algorithms in the class and students will practice data mining techniques using data mining software. Students will use Weka and SQL Server or Oracle",
https://www.bu.edu/cs/masters/program/cs/data-centric/,Databases,,
https://www.bu.edu/cs/masters/program/cs/data-centric/,Machine Learning,,
https://www.bu.edu/cs/masters/program/cs/data-centric/,Algorithms ,,
https://www.bu.edu/cs/masters/program/cs/data-centric/,Electronic Commerce,,
https://www.bu.edu/met/degrees-certificates/ms-applied-business-analytics/,Business Analytics Foundations,"This course presents fundamental knowledge and skills for applying business analytics to managerial decision-making in corporate environments. Topics include descriptive analytics (techniques for categorizing, characterizing, consolidation, and classifying data for conversion into useful information for the purposes of understanding and analyzing business performance), predictive analytics (techniques for detection of hidden patterns in large quantities of data to segment and group data into coherent sets in order to predict behavior and trends), prescriptive analytics (techniques for identification of best alternatives for maximizing or minimizing business objectives). Students will learn how to use data effectively to drive rapid, precise, and profitable analytics-based decisions. The framework of using interlinked data-inputs, analytics models, and decision-support tools will be applied within a proprietary business analytics shell and demonstrated with examples from different functional areas of the enterprise",
https://www.bu.edu/met/degrees-certificates/ms-applied-business-analytics/,Operations Management: Business Process Fundamentals,This course helps students to develop an understanding of the impact of business processes on the organization's performance and provides students the key tools to analyze and improve processes in both manufacturing and service sectors.,
https://www.bu.edu/met/degrees-certificates/ms-applied-business-analytics/,Financial Concepts,"Introduction to the concepts, methods and problems of accounting and financial analysis. Includes accounting principles, measurement and disclosure issues, financial statement analysis, time value of money, cash flow projection and analysis, capital budgeting and project evaluation, bond and equity valuation, cost of capital and capital structure.",
https://www.bu.edu/met/degrees-certificates/ms-applied-business-analytics/,Quantitative and Qualitative Decision-Making,"Explores decision making and policy formulation in organizations. Includes goal setting and the planning process, rational models of decision making, evaluation of alternatives, prediction of outcomes, cost-benefit analysis, decision trees, uncertainty and risk assessment, and procedures for evaluation of outcomes",
https://www.bu.edu/met/degrees-certificates/ms-applied-business-analytics/,Enterprise Risk Analytics,"The course offers an overview of the key current and emerging enterprise risk analytical approaches used by corporations and governmental institutions and is focused on understanding and implementing the enterprise risk management framework on how to leverage the opportunities around a firm to increase firm value. The major risk categories of the enterprise risk management such as financial risk, strategic risk and operational risk will be discussed and risk analytics approaches for each of these risks will be covered. Students will learn how to use interlinked data-inputs, analytics models, business statistics, optimization techniques, simulation, and decision-support tools. An integrated enterprise risk analytics approach will be demonstrated with examples from different functional areas of the enterprise.",
https://www.bu.edu/met/degrees-certificates/ms-applied-business-analytics/,Marketing Analytics,"Become familiar with the foundations of modern marketing analytics and develop your ability to select, apply, and interpret readily available data on customer purchase behavior, new customer acquisition, current customer retention, and marketing mix optimization. This course explores approaches and techniques to support the managerial decision-making process and skills in using state-of-the-art statistical and analytics tools. Students will have an opportunity to gain basic understanding of how transaction and descriptive data are used to construct customer segmentation schemas, build and calibrate predictive models, and quantify the incremental impact of specific marketing actions.",
https://www.bu.edu/met/degrees-certificates/ms-applied-business-analytics/,Web Analytics for Business,"Explore web analytics, text mining, web mining, and practical application domains. The web analytics part of the course studies the metrics of websites, their content, user behavior, and reporting. The Google analytics tool is used for collection of website data and doing the analysis. The text mining module covers the analysis of text including content extraction, string matching, clustering, classification, and recommendation systems. The web mining module presents how web crawlers process and index the content of web sites, how search works, and how results are ranked. Application areas mining the social web and game metrics will be extensively investigated. ",
https://www.bu.edu/met/degrees-certificates/ms-applied-business-analytics/,Data Mining for Business Analytics,"Enterprises, organizations and individuals are creating, collecting, and using massive amount of structured and unstructured data with the goal to convert the information into knowledge, to improve the quality and the efficiency of their decision-making process, and to better position themselves to the highly competitive marketplace. Data mining is the process of finding, extracting, visualizing and reporting useful information and insights from both small and large datasets with the help of sophisticated data analysis methods. It is part of the business analytics, which refers to the process of leveraging different forms of analytical techniques to achieve desired business outcomes through requiring business relevancy, actionable insight, performance management, and value management. The students in this course will study the fundamental principles and techniques of data mining. They will learn how to apply advanced models and software applications for data mining. Finally, students will learn how to examine the overall business process of an organization or a project with the goal to understand (i) the business context where hidden internal and external value is to be identified and captured, and (ii) exactly what the selected data mining method does.",
http://www.bu.edu/cs/masters/program/ai/,Artificial Intelligence,,
http://www.bu.edu/cs/masters/program/ai/,Machine Learning,,
http://www.bu.edu/cs/masters/program/ai/,Image and Video Computing,,
http://www.bu.edu/cs/masters/program/ai/,Introduction to Natural Language Processing,,
http://www.bu.edu/questrom/ms-in-business-analytics/,"Describing, Analyzing and Using Data",,
http://www.bu.edu/questrom/ms-in-business-analytics/,Introduction to Programming for Data Science,,
http://www.bu.edu/questrom/ms-in-business-analytics/,Business Analytics Toolbox,,
http://www.bu.edu/questrom/ms-in-business-analytics/,Introduction to Data Analytics,,
http://www.bu.edu/questrom/ms-in-business-analytics/,Supervised Machine Learning,,
http://www.bu.edu/questrom/ms-in-business-analytics/,Unsupervised and Unstructured Machine Learning,,
http://www.bu.edu/questrom/ms-in-business-analytics/,Business Experimentation and Causal Methods,,
http://www.bu.edu/questrom/ms-in-business-analytics/,Data Ethics,,
https://csweb.rice.edu/academics/graduate-programs/professional-master-data-science,Programming Languages and Design,"This course covers important concepts of programming languages that are critical to understanding and constructing software artifacts. You will study these concepts in the context of multiple programming paradigms, including functional and object-oriented programming. By using different paradigms, you will learn to think more deeply than in terms of a single approach or the syntax of one language. This course aims to provide a framework for understanding how to use language constructs effectively and how to design correct and elegant programs in any language.",
https://csweb.rice.edu/academics/graduate-programs/professional-master-data-science, Machine Learning ,"Machine learning is the automation of the inductive learning process that humans do so well. Machine learning is critical to the fields of robotics, medicine, security and transportation. In this course that focuses on practical applications, you will gain a foundational understanding of modern algorithms in machine learning.",
https://csweb.rice.edu/academics/graduate-programs/professional-master-data-science,Big Data,"Data science is the study of how to extract actionable, non-trivial knowledge from data. This course will introduce you to data science and focus on the software tools used by practitioners of modern data science and the mathematical and statistical models that are employed in conjunction with those tools. You will learn how to apply these tools and systems to different problems and domains with a focus on the analysis of “big” data — datasets that are too large to be analyzed on a typical personal computer.",
https://csweb.rice.edu/academics/graduate-programs/professional-master-data-science,Data Visualization ,Data is being generated by humans and algorithms at an astounding rate. Analyzing and interpreting this data visually is key to informed decision-making across industries. This class will cover the basic ways that various types of data can be visualized and what properties distinguish useful visualizations from not-so-useful ones. You will learn to use Python as both the primary tool for processing the data and for creating visualizations of this data.,
https://csweb.rice.edu/academics/graduate-programs/professional-master-data-science,Statistics for Computing and Data Science,"Probability and statistics are essential tools in data science and central to fields like bioinformatics, social informatics, and machine learning. They are the foundation for quantifying uncertainty and assessing support for hypotheses and derived models, and are at the heart of areas such as efficiency analysis of algorithms and randomized algorithms. This course covers topics in probability and statistics, including probability and random variables, basic stochastic processes, basic descriptive statistics, and various methods for statistical inference and measuring support.",
https://healthinformatics.georgetown.edu/#_ga=2.261589773.1422061659.1623151628-565262736.1623151628,Massive Health Data Fundamentals,"This basic course is a broad overview of how data analytics is used in healthcare and medical research settings. Here, we primarily focus on the use of a data analytic framework to advance the goals of healthcare, research and product development organizations. We attempt to cover the people, process, infrastructure needs, tools, skills, organization and governance to effectively perform this work in a healthcare organization or an organization that is in the ecosystem of a healthcare system. We do not focus on any particular quantitative methodologies. Here we provide a broad overview of the field with exposure to several common tools, software packages, use cases with a focus on hands-on problem solving with real world datasets.",
https://healthinformatics.georgetown.edu/#_ga=2.261589773.1422061659.1623151628-565262736.1623151628,Utilizing Data in Electronic Medical Records,"The scientific utility of EHR derived “routine” clinical data generated as a byproduct of care delivery has been previously demonstrated, and there are no insurmountable technical challenges or barriers to achieving the effective use of this type of data for a national cohort of millions of individuals.

This course is designed to introduce students to one of the major components of data collection, analysis and clinical decision support systems at the point of care: The electronic health record systems (EHR) and their use in care management, research, and analytics. The course is intended to familiarize students with data access across multiple data sources. This is a practical, hands on experience course that will introduce students to the variety of systems used in the clinic and the complex interactions and features that make up a modern clinical information system.

Students will learn different aspects of EHR systems in both inpatient and outpatient clinical environments, and will focus on data extraction, exploring analytics and visualization capabilities and generating insights from the perspective of EHR.

This is an introduction‐level course, designed to offer the most benefit to Health Data Scientists and offers a deep learning experience of EHR functionality.",
https://healthinformatics.georgetown.edu/#_ga=2.261589773.1422061659.1623151628-565262736.1623151628,Precision Health Informatics,"This course is designed to provide fundamentals of current computational approaches to support and enable Precision Medicine through data management, analysis and visualization. The successful implementation of precision medicine initiatives requires professionals who are well-versed in informatics. According to recent publications a closer look at strategic plans focused on research and clinical implementation of precision medicine efforts revealed significant gaps in expertise that impacts the ability of a health system to relate genomic data to better health outcomes. Clinical and biomedical informatics, with their focus on how information is collected, stored, analyzed and disseminated, are two important areas for the advancement of precision medicine. Providing data that has clinical relevance on a patient specific level as well as presenting that data in a way that makes it easier for physicians to interpret and use it in their decision-making process, informatics is essentially the engine that will power precision medicine into widespread adoption. This course covers the two broad focus areas: Precision Medicine in the context of Molecular Medicine and genomic technologies, and Precision Medicine in the context of data analytics integrating clinical data with genotype or other biomarker type data. Course details:  this course will consist of 4 modules, quizzes and final exam. Modules include: Precision Medicine fundamentals: concepts and approaches; Molecular Diagnostics: major technologies, platforms, resources and providers; Data Commons: on-line resources and tools for large scale Big Biomedical data; Data Analytics solutions for Precision Medicine.",
https://healthinformatics.georgetown.edu/#_ga=2.261589773.1422061659.1623151628-565262736.1623151628,Evidence-based Data Analysis in Population Health,"The class will focus on key concepts about evidence-based approaches in data science, including the analysis of population health datasets and the discussion of important case studies. Students will learn important principles for organizing and analyzing data, along with concepts and tools for reproducible research, for which they will gain hands-on experience with the R programming language. Students will then expand their understanding of study design and evidence-based medicine, discussing important literature in this area and where the field is going regarding innovative designs. Finally, there will be an emphasis on the understanding of “meta-research” or “research on research,” focusing on the understanding of reproducibility and replicability.",
https://healthinformatics.georgetown.edu/#_ga=2.261589773.1422061659.1623151628-565262736.1623151628,Advanced Topics in Health Informatics,"This course provides a broad overview of Health Informatics and is designed for the health data science program.  Given the generally high level of Health Informatics field and its important role in the healthcare delivery, it is likely that each of you will have (or may already have had) some notion about informatics, information technologies in healthcare at some point in your careers.  This course will provide you with a framework to help you understand the informatics environment in healthcare, to assess different components of the ecosystem, to develop understanding about each of the major building blocks, and to be able to think about the specific technologies enabling health information access, sharing and analysis to improve performance, efficiency and enable a better patient outcome.  This course also provides an understanding of the leadership role of the health data scientist, implementation and management of technologies including computer based decision models to structure information and analyze complex organizational problems. Current and future IT applications such as the electronic health record (EHR), mobile health, and telemedicine will be analyzed for their influence on cost, quality and access to care; the legal, ethical and regulatory ramifications of these technological advances will also be explored.",
https://healthinformatics.georgetown.edu/#_ga=2.261589773.1422061659.1623151628-565262736.1623151628,AI for Health Applications,"This course will provide a hands-on opportunity to explore the current applications of artificial intelligence and machine learning in biomedicine and healthcare. Focused around case studies representing the successful examples of these algorithms, students will learn the mathematical formulations underlying the methods, understand the computational requirements and limitations of their application, and explore their use in healthcare research applications. In general, a single ML/AI method will be addressed each week, and consist of lecture on the underlying algorithm, discussion of applications from the literature, and an interactive workshop illustrating its application to a test example dataset. Homework will test the implementation of the given algorithms on a curated dataset and explore the unique attributes.",
