https://goizueta.emory.edu/msba,Machine Learning,"This is an introduction to basic concepts in machine learning, both supervised and unsupervised. The basic ideas of neural networks will be presented. Machine learning from data streams (online learning) using stochastic gradient descent is also covered. Delve into a number of selected current and emerging data analytics areas that are increasingly important for organizations. Areas include advanced elements of the predictive modeling process, ensemble methods, cost-aware data analytics, mining text and data, recommender systems, and other advanced topics.",
https://goizueta.emory.edu/msba,Data Visualization,"Where the art of graphic design meets with the science of data analytics. Learn how to perform exploratory analysis through visualization, how to create professional-looking visualizations for use in business reports and presentations, and how to design interactive visualizations and dashboards.",
https://goizueta.emory.edu/msba,Decision Analytics and Optimization,"This course introduces students to optimization and simulation, powerful techniques for better decision-making (in particular, linear, integer and non-linear programming), and Monte Carlo and discrete event simulation, and discuss their application to problems in business and data analytics.",
https://goizueta.emory.edu/msba,Marketing Analytics,"This course uses analytic methods to solve marketing problems (including pricing, customer relationship management and sales forecasting). We emphasize the development of tools that can be implemented in practice to support decision making and rely on frequentist and Bayesian methodologies.",
https://goizueta.emory.edu/msba,Sports Analytics,"This course focuses on tools and techniques applicable to decision making in sports. The analytical foundations for the class are classical statistical and optimization techniques. We solve sports problems using tools such as linear regression, logistic regression, Markov chains, and optimization.",
https://goizueta.emory.edu/msba,Human Resources Analytics,"This course introduces students to statistical and computational methods used in employee recruitment, selection, promotion and turnover. A significant portion of the course is devoted to experimental methods designed to test the efficacy of HR policies before an organization implements them.",
https://gsm.ucdavis.edu/master-science-business-analytics-msba,"Information, Insights, and Impact",,
https://gsm.ucdavis.edu/master-science-business-analytics-msba,Organizational Issues in Implementing Analytics,,
https://gsm.ucdavis.edu/master-science-business-analytics-msba,Application Domains,,
https://gsm.ucdavis.edu/master-science-business-analytics-msba,Data Management ,,
https://gsm.ucdavis.edu/master-science-business-analytics-msba,Data Visualization,,
https://gsm.ucdavis.edu/master-science-business-analytics-msba,Data Design and Representation,,
https://gsm.ucdavis.edu/master-science-business-analytics-msba,Big Data,,
https://gsm.ucdavis.edu/master-science-business-analytics-msba,Statistical Reasoning and Exploration,,
https://gsm.ucdavis.edu/master-science-business-analytics-msba,Foundations of Analytics,,
https://gsm.ucdavis.edu/master-science-business-analytics-msba,Advanced Statistics,,
https://gsm.ucdavis.edu/master-science-business-analytics-msba,Machine Learning,,
https://gsm.ucdavis.edu/master-science-business-analytics-msba,Topics in Business Analytics,,
https://gsm.ucdavis.edu/master-science-business-analytics-msba,Analytic Decision Making,,
https://gsm.ucdavis.edu/master-science-business-analytics-msba,Topics in Business Analytics,,
https://sas.rochester.edu/dsc/graduate/ms.html,Computational Introduction to Statistics,,
https://sas.rochester.edu/dsc/graduate/ms.html,Intermediate Statistical and Computational Methods,,
https://sas.rochester.edu/dsc/graduate/ms.html,Data Mining,"Fundamental concepts and techniques of data mining, including data attributes, data visualization, data pre-processing, mining frequent patterns, association and correlation, classification methods, and cluster analysis. Advanced topics (time permitting) include outlier detection, stream mining, and social media data mining. ",
https://sas.rochester.edu/dsc/graduate/ms.html,Introduction to Databases,"This course presents the fundamental concepts of database design and use. It provides a study of data models, data description languages, and query facilities including relational algebra and SQL, data normalization, transactions and their properties, physical data organization and indexing, security issues and object databases. It also looks at the new trends in databases, for example NoSQL systems. The knowledge of the above topics will be applied in the design and implementation of a database application using a target database management system as part of a semester-long group project.",
https://www.vanderbilt.edu/datascience/academics/msprogram/program-details/,Principles of Programming & Simulation,"Students learn the foundations of effective software design and programming practice, how to program and evaluate a simulation, and how to apply modern resampling techniques in simulations in both R and Python. Students learn workflow solutions, e.g., Jupyter Notebooks, Latex, Knitr, Markdown reports, and collaboration platforms (e.g., GitHub and version control). Reproducible methods for programming and data processing are emphasized.",
https://www.vanderbilt.edu/datascience/academics/msprogram/program-details/,Survey of Data Science Applications,"This course introduces foundational data science terminology and conventions, and exposes students to a wide range of data science applications, e.g., in genomics, health care, informatics, astronomy/physics, neuroimaging, cyber-physical systems, business, and finance.",
https://www.vanderbilt.edu/datascience/academics/msprogram/program-details/,Data Science Rights & Responsibility,"This course explores the ethos, ethics, and obligations of the modern data scientist. Modern data security and privacy vulnerabilities, as well as solutions, for individual-level data and the institutions from which the data are derived will be discussed. The history, ethics, and standards for human experimentation are reviewed. The legal landscape concerning data ownership and privacy will be surveyed.",
https://www.vanderbilt.edu/datascience/academics/msprogram/program-details/,Case-studies in Data Science,"This course will focus on an in-depth exploration of multiple (e.g., 6-8) case studies of modern data science applications. For half of the case studies, students in small groups will attempt their own solutions by re-analyzing data and comparing their findings to each other and the original solution. The other case studies will focus on high-profile data science solutions, in academia and business, in which two yielded generally positive outcomes (reproducible, impactful) and two did not (not-reproducible, unethical). The processes of obtaining and processing the data, preforming the analysis, and communicating the results will be discussed.",
https://www.vanderbilt.edu/datascience/academics/msprogram/program-details/,Data Science in Teams,"Students will work in small groups to engage in real world problems, and apply their skills in a supervised environment where active learning is reinforced, and learn to make practical decisions. Students will learn how to process data, generate analysis reports and data summaries. Data will come from many sources, e.g. Kaggle competitions, VU/VUMC labs, and online documented data sets. Students will experience a goal-oriented teamwork environment and learn how to participate and support teams as the primary data curator and data analyst. Second-year students will lead the small groups formed in the Data Science in Teams I class. Here second-year students get to take on the responsibility of team leader and presenter; they will learn supervisory skills by managing team members and taking responsibility for the final project. This course also allows student cohorts to interact in a formal setting.",
https://www.vanderbilt.edu/datascience/academics/msprogram/program-details/,Data Management Systems,"This course covers database management systems, e.g., relation databases, data architecture, and security. Topics include entity-relationship models and relational theory; storage and access of data; complex SQL queries; and non-relational databases including NoSQL databases. Connections to Hadoop and MapReduce will be highlighted. Students are exposed to database architectures as time allows.",
https://www.vanderbilt.edu/datascience/academics/msprogram/program-details/,Data Science Algorithms,"An applied and practical combination of discrete structures and computational algorithms that are relevant for data science applications and infrastructure. Topics include natural language processing, graph and network models, (stochastic) gradient descent, block coordinate descent, and (quasi-) newton methods along with an overview of more traditional topics such as sorting and searching, hashing, queues, trees, string processing, advanced data structures, recurrence relations, shortest paths, matching, and dynamic programming. The course will also cover streaming algorithms for computational statistics, e.g., Monte-Carlo Markov Chain, simulated annealing, and stability of numerical algorithms.",
https://www.vanderbilt.edu/datascience/academics/msprogram/program-details/,Big Data and Scaling,"This course will address key challenges that arise when working with big data and parallel processing. Practical techniques for storing, retrieving, and scaling are discussed. Topics include high-performance computing, parallel processing, commercial cloud architectures, and mapping of data science algorithms onto scalable computing platforms.",
https://www.vanderbilt.edu/datascience/academics/msprogram/program-details/,Modeling and Machine Learning,"This is the first course in a sequence exploring statistical modeling and machine learning techniques. Both courses emphasize unifying and advanced concepts, such as prediction and calibration, classification and discrimination, optimism and cross-validation, re-sampling methods for model assessment, the evaluation of modeling assumptions and bias-variance trade-off. This first course focused on regression, generalized linear models, regularized regression, support-vector machines and kernel methods, and simple neural networks. This is the second course in a sequence exploring statistical modeling and machine learning techniques. Both courses emphasize unifying and high-level concepts such as prediction and calibration, classification and discrimination, optimism and cross-validation, re-sampling methods for model assessment, the evaluation of modeling assumptions and bias-variance trade-off. This second course covers nonparametric regression, neural networks (convolution and recurrent), deep learning, reinforcement learning, long-short term memory models, hidden-markov models and Bayesian networks.",
https://www.vanderbilt.edu/datascience/academics/msprogram/program-details/,Exploratory Data Analysis  ,"This course will teach students how to explore, summarize, and graph data (big and small). Topics include principles of perception, how to display data, scatterplots, histograms, boxplots, bar charts, dynamite plots, proper data summaries, dimensionality reduction, multidimensional scaling, and unsupervised clustering algorithms, such as principal component analysis, k-means clustering, and nearest neighbor algorithms.",
https://www.vanderbilt.edu/datascience/academics/msprogram/program-details/,Probability and Statistical Inference,"This course covers the fundamentals of probability theory and statistical inference. Topics in probability include random variables, distributions, expectations, moments, Jensen’s inequality, law of large numbers, central limit theorem. Topics in inference include maximum likelihood, point estimation (Bayesian, frequentist, and likelihood versions); hypothesis and significance testing; re-sampling techniques. Complex mathematical proofs will be illustrated with computational solutions.",
https://www.analytics.gatech.edu/,Data Analytics in Business,,
https://www.analytics.gatech.edu/,Data and Visual Analytics,,
https://www.analytics.gatech.edu/,Operations research  ,[Group of courses to choose from],
https://www.analytics.gatech.edu/,Statistics,[Group of courses to choose from],
https://www.analytics.gatech.edu/,Computing for Data Analytics,,
https://www.analytics.gatech.edu/,Introduction to Analytics Modeling,,
https://www.analytics.gatech.edu/,Introduction to Business for Analytics,,
https://giesbusiness.illinois.edu/graduate-hub/business-analytics,Enterprise Database Management,helps students to identify what data they need to answer a question. It introduces issues in pulling and cleaning data so that you can generate meaningful queries and form helpful data models.,
https://giesbusiness.illinois.edu/graduate-hub/business-analytics,Big Data Analytics, teaches students to answer questions about causal inferences and predictions. Learn to use scalable tools and methods for a wide range of analyses.,
https://giesbusiness.illinois.edu/graduate-hub/business-analytics,Data Storytelling ,"shows students how to convey compelling answers to questions and to use tools to generate compelling visualizations and narratives, with an understanding of the choices they are making regarding data presentation.",
https://graduate.seas.gwu.edu/masters-data-analytics,Data Analysis for Engineers and Scientists,"Design of experiments and data collection. Regression, correlation, and prediction. Multivariate analysis, data pooling, data compression. Model validation.",
https://graduate.seas.gwu.edu/masters-data-analytics,Database Management Systems,"Design and architecture of relational database management systems; query languages, data models, index structures, database application design.",
https://graduate.seas.gwu.edu/masters-data-analytics,	Introduction to Big Data and Analytics,"Big data, its properties, technology, and the types and classes of analytics that can be applied to it; associated storage and programming systems. Students gain practical experience through focused projects to apply different analytics to a data set. ",
https://graduate.seas.gwu.edu/masters-data-analytics,Programming for Analytics,Introduction to programming for data analytics using the Python programming language. Prepares students for higher-level courses in data analytics.,
https://graduate.seas.gwu.edu/masters-data-analytics,	Data Analytics Foundations and Practicum,"Introduction to concepts and techniques in data analytics. Basic techniques of data science; algorithms for data mining; basics of statistical modeling and their “Big Data” applications. Concepts, abstractions, and practical techniques.",
https://datasci.columbian.gwu.edu/ms-data-science,Introduction to Data Science,"Basic techniques of data science. Algorithms for data mining, basics of statistical modeling, and concepts, abstractions, and practical techniques.",
https://datasci.columbian.gwu.edu/ms-data-science,Data Warehousing,"Fundamentals and practical applications of data warehousing, including planning requirements, infrastructure, design, and maintenance. ",
https://datasci.columbian.gwu.edu/ms-data-science,Introduction to Data Mining,"Concepts, principles, and techniques related to data mining; strengths and limitations of various data mining techniques, including classification, association analysis, and cluster analysis.",
https://datasci.columbian.gwu.edu/ms-data-science,Machine Learning I: Algorithm Analysis,"Practical approach to fundamentals of algorithm design associated with machine learning; techniques of statistical and probability theory, combinatorial optimization, and factor graph and graph ensemble as used in machine learning.",
https://datasci.columbian.gwu.edu/ms-data-science,Visualization of Complex Data,"This course is a practical approach to fundamentals of data visualization specifically for data science professional. It covers all significant topics, including graphics, discrete and continuous variables, clustering and classification.",
https://business.gwu.edu/academics/programs/specialized-masters/ms-business-analytics,Statistics for Analytics,"Foundations of statistical methodologies in business analytics; statistical inference and probability models; estimation, hypothesis testing, contingency table analysis, analysis of regression models; logit and probit analysis. Statistical methodologies for business analytics in real world scenarios; introduction of high-level analytical techniques such as hierarchical linear modeling and mixed-effects modeling.",
https://business.gwu.edu/academics/programs/specialized-masters/ms-business-analytics,Stochastic Foundation: Probability Models,"Introduces the foundations of probability, along with the commonly used probability models (binomial, normal, and poisson) in predictive analytics. ",
https://business.gwu.edu/academics/programs/specialized-masters/ms-business-analytics,Decision and Risk Analytics,"Concepts, methods, and practical tools to analyze managerial decisions involving risk and uncertainty. Restricted to students in the master of science in business analytics degree program or with program approval.",
https://business.gwu.edu/academics/programs/specialized-masters/ms-business-analytics,Programming for Analytics,"Accessing, preparation, handling, and processing data that differ in variety, volume, and velocity. Development of a theoretical grounding in emerging paradigms like schema-less data. Python and R typically used. ",
https://business.gwu.edu/academics/programs/specialized-masters/ms-business-analytics,Optimization Methods and Applications,"Linear, network, integer, and nonlinear models and their fundamental underlying analytic concepts and solution methods; model development, formulation, solution and interpretation of results using powerful commercial software; intuitive understanding of solution methods and their underpinning theoretical paradigms for effective use of optimization models. ",
https://business.gwu.edu/academics/programs/specialized-masters/ms-business-analytics,Business Analytics Skills Workshops,"Practical workshop designed to develop the student's application-related skills for the analytics realm. Programming skills, computing environments (e.g. cloud or enterprise computing), and data ethics and security.",
https://business.gwu.edu/academics/programs/specialized-masters/ms-business-analytics,Time Series Forecasting for Analytics,Predictive analysis and blackbox models for time series and econometric forecasting,
https://business.gwu.edu/academics/programs/specialized-masters/ms-business-analytics,Consulting for Analytics,"Practical tools used by analysts and managing analysts, within an organization or for an external consulting-focused organization, for integrating analytical skills into problem solving.",
https://business.gwu.edu/academics/programs/specialized-masters/ms-business-analytics,Data Mining,How organizations make better use of increasing amounts of collected data and convert that data into information to support managerial decision making; data mining and data analysis methods and tools for exploring and analyzing data sets; state-of-the-art software tools for developing novel applications. Note that the prerequisite courses must be taken in the order listed.,
https://business.gwu.edu/academics/programs/specialized-masters/ms-business-analytics,Data Management for Analytics,"Relational databases, data warehousing, and dimensional modeling. Practical experience with these and other traditional and contemporary methods for managing and analyzing data at scale, including Unix command line and Apache Spark.",
https://asegrad.tufts.edu/academics/explore-graduate-programs/data-science,Probabilistic Systems Analysis,,
https://asegrad.tufts.edu/academics/explore-graduate-programs/data-science,Introduction to Machine Learning and Data Mining,,
https://asegrad.tufts.edu/academics/explore-graduate-programs/data-science,Big Data,,
https://asegrad.tufts.edu/academics/explore-graduate-programs/data-analytics,Foundations of Data Analytics,This required introductory course will provide you with a strong foundation on the general topic of data analytics,
https://asegrad.tufts.edu/academics/explore-graduate-programs/data-analytics,Communicating with Data,,
https://asegrad.tufts.edu/academics/explore-graduate-programs/data-analytics,Introduction to Python for Data Analysis,,
https://asegrad.tufts.edu/academics/explore-graduate-programs/data-analytics,Python and Machine Learning for Data Analysis,,
https://asegrad.tufts.edu/academics/explore-graduate-programs/data-analytics,Introduction to Data Visualization with Tableau,,
https://asegrad.tufts.edu/academics/explore-graduate-programs/data-analytics,Excel to SQL: Introduction to Data Management and Databases,,
https://asegrad.tufts.edu/academics/explore-graduate-programs/data-analytics,Statistical Analysis and Modeling Techniques,[Group of courses to choose from],
https://asegrad.tufts.edu/academics/explore-graduate-programs/data-analytics,Discipline-Related Application and Extensions,[Group of courses to choose from],
https://herbert.miami.edu/graduate/find-and-compare-programs/business-analytics/index.html,Communicating for Career Success,"The modern businessperson faces a constantly evolving environment and must be able to confront and respond to an array of business issues. At the heart of an effective response is a critical, comprehensive analysis coupled with the ability to meaningfully and persuasively communicate that assessment and recommendations to a variety of constituencies. This course prepares business students for this by exposing them to a three-step process of problem solving in which they critically analyze the problem, and then communicate their analysis both in writing and orally. The critical thinking and communication elements of the course are supplemented with additional practical applications relating to career readiness, job search and job procurement.",
https://herbert.miami.edu/graduate/find-and-compare-programs/business-analytics/index.html,Programming for Data Analytics,"This course will provide an introduction to various programming languages useful in data analytics. Topics covered will include cleaning, manipulating, exploring and visualizing data, as well as communicating results and reproducibility. While this course will cover wide range of topics in detail, students are not expected to have prior experience with any languages covered throughout the course.",
https://herbert.miami.edu/graduate/find-and-compare-programs/business-analytics/index.html,Statistics for Managerial Decision Making,"This course aims to familiarize the student with statistical theory, tools, and methods required for business systems analysis and improvement. Topics include descriptive methods, elementary probability, random variables and the distributions, hypothesis testing, confidence intervals, statistical modeling, and regression.",
https://herbert.miami.edu/graduate/find-and-compare-programs/business-analytics/index.html,Management Science Models for Decision Making,"This course aims to familiarize the student with Management Science tools for business systems analysis and improvement. The coverage includes linear and integer programming models, project management, simulation, queuing, and decision analysis. Some widely used software are illustrated through examples and case studies derived from business applications.",
https://herbert.miami.edu/graduate/find-and-compare-programs/business-analytics/index.html,"Data Acquisition, Preparation, and Visualization",This course teaches using statistical computing software to get a better understanding of what problems can occur (and what solutions exist) when dealing with a variety of data types and sources. It will also discuss how to address data visualization and how to leverage current methods and software to best communicate with results and decision with stakeholders.,
https://herbert.miami.edu/graduate/find-and-compare-programs/business-analytics/index.html,Applied Regression Analysis,"This course aims to familiarize the student with statistical prediction. It covers simple and multiple regression methods as well as time series and forecasting models in business. Instead of theoretical development, the course emphasize s the application of these methods in business systems analysis and improvement.",
https://herbert.miami.edu/graduate/find-and-compare-programs/business-analytics/index.html,Machine Learning for Data Analytics,"Data Mining encompasses finding meaningful and useful trends in data. The meaningful part depends on the application and even the specific data set you are using. Another definition that can be used is that data mining is the application of statistical machine learning techniques to find these trends. Our focus in this course will be on the development and use of traditional and cutting edge data mining/machine learning techniques and their applications across a spectrum of data sets. The topics we will cover are in supervised learning (regression, classification), unsupervised learning (clustering, principal components analysis, factor analysis, etc), and if time permits semi-supervised learning and recommendation systems.",
https://ece.coe.miami.edu/graduate/ms-in-electrical-and-computer-engineering-concentration-in-ai/index.html,Principles of Artificial Intelligence,,
https://ece.coe.miami.edu/graduate/ms-in-electrical-and-computer-engineering-concentration-in-ai/index.html,Machine Learning,,
